,original_idx,db_id,query,question,HAVING,ORDER BY,GROUP BY,JOIN,SELECT,WHERE,query_token_num,question_token_num
138,5777,customer_complaints,SELECT t1.email_address FROM customers AS t1 JOIN complaints AS t2 ON t1.customer_id  =  t2.customer_id GROUP BY t1.customer_id ORDER BY count(*) LIMIT 1,What are the emails of customers who have filed complaints on the product which has had the greatest number of complaints?,0,1,1,1,1,0,22,21
139,5778,customer_complaints,"SELECT t1.product_name FROM products AS t1 JOIN complaints AS t2 ON t1.product_id = t2.product_id JOIN customers AS t3 ON t2.customer_id = t3.customer_id GROUP BY t3.customer_id, t1.product_name ORDER BY COUNT(*) LIMIT 1",Which products has been complained by the customer who has filed least amount of complaints?,0,1,1,2,1,0,31,15
140,5779,customer_complaints,"SELECT t1.product_name FROM products AS t1 JOIN complaints AS t2 ON t1.product_id = t2.product_id JOIN customers AS t3 ON t2.customer_id = t3.customer_id GROUP BY t3.customer_id, t1.product_name ORDER BY COUNT(*) LIMIT 1",Return the names of products that have had complaints filed by the customer who has filed the fewest complaints.,0,1,1,2,1,0,31,19
141,5933,cre_Theme_park,"SELECT T1.Name, T3.Visit_Date FROM Tourist_Attractions AS T1 JOIN VISITS AS T3 ON T1.Tourist_Attraction_ID = T3.Tourist_Attraction_ID JOIN VISITORS AS T2 ON T2.Tourist_ID = T3.Tourist_ID WHERE T2.Tourist_Details = 'Vincent' OR T2.Tourist_Details = 'Vivian'",What are the names of the tourist attractions and the dates when the tourists named Vincent or Vivian visited there?,0,0,0,2,1,1,31,20
142,5960,cre_Theme_park,SELECT T1.Name FROM Tourist_Attractions AS T1 JOIN Tourist_Attraction_Features AS T2 ON T1.tourist_attraction_id  =  T2.tourist_attraction_id JOIN Features AS T3 ON T2.Feature_ID  =  T3.Feature_ID WHERE T3.feature_Details  =  'park' UNION SELECT T1.Name FROM Tourist_Attractions AS T1 JOIN Tourist_Attraction_Features AS T2 ON T1.tourist_attraction_id  =  T2.tourist_attraction_id JOIN Features AS T3 ON T2.Feature_ID  =  T3.Feature_ID WHERE T3.feature_Details  =  'shopping',Find the tourist attractions that have parking or shopping as their feature details. What are the names of the attractions?,0,0,0,4,2,2,53,20
143,6110,customers_and_addresses,SELECT t1.customer_name FROM customers AS t1 JOIN customer_orders AS t2 ON t1.customer_id = t2.customer_id JOIN order_items AS t3 ON t2.order_id = t3.order_id GROUP BY t1.customer_name ORDER BY SUM(CAST(t3.order_quantity AS integer)) DESC LIMIT 1,Give me the name of the customer who ordered the most items in total.,0,1,1,2,1,0,33,14
144,6111,customers_and_addresses,"SELECT t1.payment_method FROM customers AS t1 JOIN customer_orders AS t2 ON t1.customer_id = t2.customer_id JOIN order_items AS t3 ON t2.order_id = t3.order_id GROUP BY t1.customer_name, t1.payment_method ORDER BY SUM(CAST(t3.order_quantity AS integer)) LIMIT 1",What is the payment method of the customer that has purchased the least quantity of items?,0,1,1,2,1,0,33,16
145,6112,customers_and_addresses,"SELECT t1.payment_method FROM customers AS t1 JOIN customer_orders AS t2 ON t1.customer_id = t2.customer_id JOIN order_items AS t3 ON t2.order_id = t3.order_id GROUP BY t1.customer_name, t1.payment_method ORDER BY SUM(CAST(t3.order_quantity AS integer)) LIMIT 1",Tell me the payment method used by the customer who ordered the least amount of goods in total.,0,1,1,2,1,0,33,18
146,6138,customers_and_addresses,SELECT customer_name FROM customers EXCEPT SELECT t1.customer_name FROM customers AS t1 JOIN customer_orders AS t2 ON t1.customer_id  =  t2.customer_id JOIN order_items AS t3 ON t2.order_id  =  t3.order_id JOIN products AS t4 ON t3.product_id  =  t4.product_id WHERE t4.product_details  =  'Latte',What are names of customers who never ordered product Latte.,0,0,0,3,2,1,39,10
147,6142,customers_and_addresses,SELECT t1.customer_name FROM customers AS t1 JOIN customer_orders AS t2 ON t1.customer_id  =  t2.customer_id JOIN order_items AS t3 ON t2.order_id  =  t3.order_id JOIN products AS t4 ON t3.product_id  =  t4.product_id WHERE t4.product_details  =  'Latte' INTERSECT SELECT t1.customer_name FROM customers AS t1 JOIN customer_orders AS t2 ON t1.customer_id  =  t2.customer_id JOIN order_items AS t3 ON t2.order_id  =  t3.order_id JOIN products AS t4 ON t3.product_id  =  t4.product_id WHERE t4.product_details  =  'Americano',What are the names of customers who have purchased both products Latte and Americano?,0,0,0,6,2,2,69,14
148,6192,music_4,SELECT T1.Famous_Title FROM artist AS T1 JOIN volume AS T2 ON T1.Artist_ID  =  T2.Artist_ID WHERE T2.Weeks_on_Top  >  2 INTERSECT SELECT T1.Famous_Title FROM artist AS T1 JOIN volume AS T2 ON T1.Artist_ID  =  T2.Artist_ID WHERE T2.Weeks_on_Top  <  2,What are the famous titles of artists who have not only had volumes that spent more than 2 weeks on top but also volumes that spent less than 2 weeks on top?,0,0,0,2,2,2,37,32
149,6324,e_government,SELECT t3.individual_last_name FROM organizations AS t1 JOIN organization_contact_individuals AS t2 ON t1.organization_id  =  t2.organization_id JOIN individuals AS t3 ON t2.individual_id  =  t3.individual_id WHERE t1.uk_vat_number  =  (SELECT max(uk_vat_number) FROM organizations) ORDER BY t2.date_contact_to ASC LIMIT 1,Find the last name of the first ever contact person of the organization with the highest UK Vat number.,0,1,0,2,2,1,35,19
150,6325,e_government,SELECT t3.individual_last_name FROM organizations AS t1 JOIN organization_contact_individuals AS t2 ON t1.organization_id  =  t2.organization_id JOIN individuals AS t3 ON t2.individual_id  =  t3.individual_id WHERE t1.uk_vat_number  =  (SELECT max(uk_vat_number) FROM organizations) ORDER BY t2.date_contact_to ASC LIMIT 1,What is the last name of the first individual contacted from the organization with the maximum UK Vat number across all organizations?,0,1,0,2,2,1,35,22
151,6340,e_government,SELECT t1.party_email FROM parties AS t1 JOIN party_services AS t2 ON t1.party_id  =  t2.customer_id GROUP BY t1.party_email ORDER BY count(*) DESC LIMIT 1,Which is the email of the party that has used the services the most number of times?,0,1,1,1,1,0,23,17
152,6341,e_government,SELECT t1.party_email FROM parties AS t1 JOIN party_services AS t2 ON t1.party_id  =  t2.customer_id GROUP BY t1.party_email ORDER BY count(*) DESC LIMIT 1,Return the party email that has used party services the greatest number of times.,0,1,1,1,1,0,23,14
153,6398,cre_Docs_and_Epenses,"SELECT T1.statement_id, T2.statement_details FROM Accounts AS T1 JOIN Statements AS T2 ON T1.statement_id = T2.statement_id GROUP BY T1.statement_id, T2.statement_details ORDER BY count(*) DESC LIMIT 1",What are the statement id and statement detail for the statement that has the most corresponding accounts?,0,1,1,1,1,0,25,17
154,6563,wine_1,"SELECT T1.Area FROM APPELLATIONS AS T1 JOIN WINE AS T2 ON T1.Appelation = T2.Appelation WHERE T2.year < 2010 GROUP BY T2.Appelation, T1.Area ORDER BY count(*) DESC LIMIT 1",What is the area of the appelation that produces the highest number of wines before the year of 2010?,1,1,1,1,1,1,28,19
155,6564,wine_1,"SELECT T1.Area FROM APPELLATIONS AS T1 JOIN WINE AS T2 ON T1.Appelation = T2.Appelation WHERE T2.year < 2010 GROUP BY T2.Appelation, T1.Area ORDER BY count(*) DESC LIMIT 1",What is the area for the appelation which produced the most wines prior to 2010?,1,1,1,1,1,1,28,15
156,6565,wine_1,"SELECT T1.Color FROM GRAPES AS T1 JOIN WINE AS T2 ON T1.Grape = T2.Grape GROUP BY T2.Grape, T1.Color ORDER BY AVG(Price) DESC LIMIT 1",What is the color of the grape whose wine products has the highest average price?,0,1,1,1,1,0,24,15
157,6566,wine_1,"SELECT T1.Color FROM GRAPES AS T1 JOIN WINE AS T2 ON T1.Grape = T2.Grape GROUP BY T2.Grape, T1.Color ORDER BY AVG(Price) DESC LIMIT 1",Give the color of the grape whose wine products have the highest average price?,0,1,1,1,1,0,24,14
158,6581,wine_1,"select DISTINCT T1.County FROM APPELLATIONS AS T1 JOIN WINE AS T2 ON T1.Appelation = T2.Appelation GROUP BY T1.County, T2.Appelation HAVING count(*) <= 3",Find the country of all appelations who have at most three wines.,1,0,1,1,1,0,23,12
159,6582,wine_1,"select DISTINCT T1.County FROM APPELLATIONS AS T1 JOIN WINE AS T2 ON T1.Appelation = T2.Appelation GROUP BY T1.County, T2.Appelation HAVING count(*) <= 3",What are the countries for appelations with at most 3 wines?,1,0,1,1,1,0,23,11
160,6587,wine_1,SELECT T2.Winery FROM GRAPES AS T1 JOIN WINE AS T2 ON T1.GRAPE  =  T2.GRAPE WHERE T1.Color  =  'White' GROUP BY T2.Winery ORDER BY count(*) DESC LIMIT 3,Find the top 3 wineries with the greatest number of wines made of white color grapes.,0,1,1,1,1,1,27,16
161,6588,wine_1,SELECT T2.Winery FROM GRAPES AS T1 JOIN WINE AS T2 ON T1.GRAPE  =  T2.GRAPE WHERE T1.Color  =  'White' GROUP BY T2.Winery ORDER BY count(*) DESC LIMIT 3,Which 3 wineries produce the most wines made from white grapes?,0,1,1,1,1,1,27,11
162,6619,train_station,SELECT T2.name FROM train_station AS T1 JOIN station AS T2 ON T1.station_id  =  T2.station_id JOIN train AS T3 ON T3.train_id  =  T1.train_id WHERE T3.Name  =  'Ananthapuri Express' INTERSECT SELECT T2.name FROM train_station AS T1 JOIN station AS T2 ON T1.station_id  =  T2.station_id JOIN train AS T3 ON T3.train_id  =  T1.train_id WHERE T3.Name  =  'Guruvayur Express',"What are the names of the stations which serve both ""Ananthapuri Express"" and ""Guruvayur Express"" trains?",0,0,0,4,2,2,55,16
163,6689,driving_school,SELECT T2.city FROM Customers AS T1 JOIN Addresses AS T2 ON T1.customer_address_id = T2.address_id GROUP BY T2.city ORDER BY count(*) DESC LIMIT 1;,What is the city with the most customers?,0,1,1,1,1,0,23,8
164,6759,activity_1,"SELECT T1.fname ,  T1.lname FROM Faculty AS T1 JOIN Student AS T2 ON T1.FacID  =  T2.advisor GROUP BY T1.FacID ORDER BY count(*) DESC LIMIT 1",What are the first and last name of the faculty who has the most students?,0,1,1,1,1,0,24,15
165,6799,activity_1,SELECT T1.lname FROM Faculty AS T1 JOIN Faculty_participates_in AS T2 ON T1.facID  =  T2.facID JOIN activity AS T3 ON T2.actid  =  T2.actid WHERE T3.activity_name  =  'Canoeing' INTERSECT SELECT T1.lname FROM Faculty AS T1 JOIN Faculty_participates_in AS T2 ON T1.facID  =  T2.facID JOIN activity AS T3 ON T2.actid  =  T2.actid WHERE T3.activity_name  =  'Kayaking',Find the first names of the faculty members who participate in Canoeing and Kayaking.,0,0,0,4,2,2,53,14
166,6800,activity_1,SELECT T1.lname FROM Faculty AS T1 JOIN Faculty_participates_in AS T2 ON T1.facID  =  T2.facID JOIN activity AS T3 ON T2.actid  =  T2.actid WHERE T3.activity_name  =  'Canoeing' INTERSECT SELECT T1.lname FROM Faculty AS T1 JOIN Faculty_participates_in AS T2 ON T1.facID  =  T2.facID JOIN activity AS T3 ON T2.actid  =  T2.actid WHERE T3.activity_name  =  'Kayaking',What are the first names of the faculty members playing both Canoeing and Kayaking?,0,0,0,4,2,2,53,14
167,6900,tracking_orders,SELECT T1.customer_id FROM customers AS T1 JOIN orders AS T2 ON T1.customer_id  =  T2.customer_id GROUP BY T1.customer_id ORDER BY count(*) DESC LIMIT 1,Find the id of the customer who made the most orders.,0,1,1,1,1,0,23,11
168,6917,tracking_orders,"SELECT count(*) , T3.product_id FROM orders AS T1 JOIN order_items AS T2 ON T1.order_id = T2.order_id JOIN products AS T3 ON T2.product_id = T3.product_id GROUP BY T3.product_id",List the count and id of each product in all the orders.,0,0,1,2,1,0,26,12
169,6918,tracking_orders,"SELECT count(*) , T3.product_id FROM orders AS T1 JOIN order_items AS T2 ON T1.order_id = T2.order_id JOIN products AS T3 ON T2.product_id = T3.product_id GROUP BY T3.product_id","For each product, return its id and the number of times it was ordered.",0,0,1,2,1,0,26,14
170,6919,tracking_orders,"SELECT T3.product_name , count(*) FROM orders AS T1 JOIN order_items AS T2 ON T1.order_id = T2.order_id JOIN products AS T3 ON T2.product_id = T3.product_id GROUP BY T3.product_id",List the name and count of each product in all orders.,0,0,1,2,1,0,26,11
171,6920,tracking_orders,"SELECT T3.product_name , count(*) FROM orders AS T1 JOIN order_items AS T2 ON T1.order_id = T2.order_id JOIN products AS T3 ON T2.product_id = T3.product_id GROUP BY T3.product_id","For each product, show its name and the number of times it was ordered.",0,0,1,2,1,0,26,14
172,6929,tracking_orders,SELECT T1.order_id FROM orders AS T1 JOIN order_items AS T2 ON T1.order_id = T2.order_id GROUP BY T1.order_id ORDER BY count(*) DESC LIMIT 1,What is the id of the order which has the most items?,0,1,1,1,1,0,23,12
173,6930,tracking_orders,SELECT T1.order_id FROM orders AS T1 JOIN order_items AS T2 ON T1.order_id = T2.order_id GROUP BY T1.order_id ORDER BY count(*) DESC LIMIT 1,Which order deals with the most items? Return the order id.,0,1,1,1,1,0,23,11
174,6941,tracking_orders,SELECT T1.customer_name FROM customers AS T1 JOIN orders AS T2 ON T1.customer_id = T2.customer_id JOIN order_items AS T3 ON T2.order_id = T3.order_id JOIN products AS T4 ON T3.product_id = T4.product_id WHERE T4.product_name = 'food' GROUP BY T1.customer_id HAVING count(*) >= 1,"List the names of the customers who have once bought product ""food"".",1,0,1,3,1,1,41,12
175,6942,tracking_orders,SELECT T1.customer_name FROM customers AS T1 JOIN orders AS T2 ON T1.customer_id = T2.customer_id JOIN order_items AS T3 ON T2.order_id = T3.order_id JOIN products AS T4 ON T3.product_id = T4.product_id WHERE T4.product_name = 'food' GROUP BY T1.customer_id HAVING count(*) >= 1,"What are the names of the customers who bought product ""food"" at least once?",1,0,1,3,1,1,41,14
176,6943,tracking_orders,SELECT T1.customer_name FROM customers AS T1 JOIN orders AS T2 ON T1.customer_id = T2.customer_id JOIN order_items AS T3 ON T2.order_id = T3.order_id JOIN products AS T4 ON T3.product_id = T4.product_id WHERE T3.order_item_status = 'Cancel' AND T4.product_name = 'food' GROUP BY T1.customer_id HAVING count(*) >= 1,"List the names of customers who have once canceled the purchase of the product ""food"" (the item status is ""Cancel"").",1,0,1,3,1,1,45,20
177,6944,tracking_orders,SELECT T1.customer_name FROM customers AS T1 JOIN orders AS T2 ON T1.customer_id = T2.customer_id JOIN order_items AS T3 ON T2.order_id = T3.order_id JOIN products AS T4 ON T3.product_id = T4.product_id WHERE T3.order_item_status = 'Cancel' AND T4.product_name = 'food' GROUP BY T1.customer_id HAVING count(*) >= 1,"Which customers have ever canceled the purchase of the product ""food"" (the item status is ""Cancel"")?",1,0,1,3,1,1,45,16
178,6955,architecture,"SELECT T1.id ,  T1.name ,  T1.gender FROM architect AS T1 JOIN bridge AS T2 ON T1.id  =  T2.architect_id GROUP BY T1.id HAVING count(*)  =  2 UNION SELECT T1.id ,  T1.name ,  T1.gender FROM architect AS T1 JOIN mill AS T2 ON T1.id  =  T2.architect_id GROUP BY T1.id HAVING count(*)  =  1","What are the ids, names and genders of the architects who built two bridges or one mill?",2,0,2,2,2,0,47,17
179,7065,pets_1,"SELECT T1.fname ,  T1.age FROM student AS T1 JOIN has_pet AS T2 ON T1.stuid  =  T2.stuid JOIN pets AS T3 ON T3.petid  =  T2.petid WHERE T3.pettype  =  'dog' AND T1.stuid NOT IN (SELECT T1.stuid FROM student AS T1 JOIN has_pet AS T2 ON T1.stuid  =  T2.stuid JOIN pets AS T3 ON T3.petid  =  T2.petid WHERE T3.pettype  =  'cat')",Find the first name and age of students who have a dog but do not have a cat as a pet.,0,0,0,4,2,2,57,21
180,7066,pets_1,"SELECT T1.fname ,  T1.age FROM student AS T1 JOIN has_pet AS T2 ON T1.stuid  =  T2.stuid JOIN pets AS T3 ON T3.petid  =  T2.petid WHERE T3.pettype  =  'dog' AND T1.stuid NOT IN (SELECT T1.stuid FROM student AS T1 JOIN has_pet AS T2 ON T1.stuid  =  T2.stuid JOIN pets AS T3 ON T3.petid  =  T2.petid WHERE T3.pettype  =  'cat')",What is the first name of every student who has a dog but does not have a cat?,0,0,0,4,2,2,57,18
181,7129,car_1,SELECT T1.CountryName FROM COUNTRIES AS T1 JOIN CONTINENTS AS T2 ON T1.Continent  =  T2.ContId JOIN CAR_MAKERS AS T3 ON T1.CountryId  =  T3.Country WHERE T2.Continent  =  'europe' GROUP BY T1.CountryName HAVING count(*)  >=  3;,Which countries in europe have at least 3 car manufacturers?,1,0,1,2,1,1,33,10
182,7130,car_1,SELECT T1.CountryName FROM COUNTRIES AS T1 JOIN CONTINENTS AS T2 ON T1.Continent  =  T2.ContId JOIN CAR_MAKERS AS T3 ON T1.CountryId  =  T3.Country WHERE T2.Continent  =  'europe' GROUP BY T1.CountryName HAVING count(*)  >=  3;,What are the names of all European countries with at least 3 manufacturers?,1,0,1,2,1,1,33,13
183,7171,car_1,SELECT DISTINCT T1.model FROM MODEL_LIST AS T1 JOIN CAR_NAMES AS T2 ON T1.Model  =  T2.Model JOIN CARS_DATA AS T3 ON T2.MakeId  =  T3.Id JOIN CAR_MAKERS AS T4 ON T1.Maker  =  T4.Id WHERE T3.weight  <  3500 AND T4.FullName != 'Ford Motor Company';,Which models are lighter than 3500 but not built by the 'Ford Motor Company'?,0,0,0,3,1,1,41,14
184,7175,car_1,"select t1.id ,  t1.maker from car_makers as t1 join model_list as t2 on t1.id  =  t2.maker group by t1.id having count(*)  >=  2 intersect select t1.id ,  t1.maker from car_makers as t1 join model_list as t2 on t1.id  =  t2.maker join car_names as t3 on t2.model  =  t3.model group by t1.id having count(*)  >  3;",Which are the car makers which produce at least 2 models and more than 3 car makers ? List the id and the maker .,2,0,2,3,2,0,53,25
185,7176,car_1,"SELECT T1.Id ,  T1.Maker FROM CAR_MAKERS AS T1 JOIN MODEL_LIST AS T2 ON T1.Id  =  T2.Maker GROUP BY T1.Id HAVING count(*)  >=  2 INTERSECT SELECT T1.Id ,  T1.Maker FROM CAR_MAKERS AS T1 JOIN MODEL_LIST AS T2 ON T1.Id  =  T2.Maker JOIN CAR_NAMES AS T3 ON T2.model  =  T3.model GROUP BY T1.Id HAVING count(*)  >  3;",What are the ids and makers of all car makers that produce at least 2 models and make more than 3 cars?,2,0,2,3,2,0,53,22
186,7177,car_1,"SELECT T1.countryId ,  T1.CountryName FROM Countries AS T1 JOIN CAR_MAKERS AS T2 ON T1.CountryId  =  T2.Country GROUP BY T1.countryId HAVING count(*)  >  3 UNION SELECT T1.countryId ,  T1.CountryName FROM Countries AS T1 JOIN CAR_MAKERS AS T2 ON T1.CountryId  =  T2.Country JOIN MODEL_LIST AS T3 ON T2.Id  =  T3.Maker WHERE T3.Model  =  'fiat';",What are the id and names of the countries which have more than 3 car makers or produce the 'fiat' model?,1,0,1,3,2,1,50,21
187,7178,car_1,"select t1.countryid ,  t1.countryname from countries as t1 join car_makers as t2 on t1.countryid  =  t2.country group by t1.countryid having count(*)  >  3 union select t1.countryid ,  t1.countryname from countries as t1 join car_makers as t2 on t1.countryid  =  t2.country join model_list as t3 on t2.id  =  t3.maker where t3.model  =  'fiat';",What are the ids and names of all countries that either have more than 3 car makers or produce fiat model ?,1,0,1,3,2,1,50,22
188,7421,museum_visit,"SELECT t2.""Museum_ID"", t1.""Name"" FROM ""museum"" AS t1 JOIN ""visit"" AS t2 ON t1.""Museum_ID"" = t2.""Museum_ID"" GROUP BY t2.""Museum_ID"", t1.""Name"" ORDER BY count(*) DESC LIMIT 1",What are the id and name of the museum visited most times?,0,1,1,1,1,0,25,12
189,7426,museum_visit,"SELECT t1.""Name"" FROM ""visitor"" AS t1 JOIN ""visit"" AS t2 ON t1.""ID"" = t2.""visitor_ID"" JOIN ""museum"" AS t3 ON t3.""Museum_ID"" = t2.""Museum_ID"" WHERE t3.""Open_Year"" < '2009' INTERSECT SELECT t1.""Name"" FROM ""visitor"" AS t1 JOIN ""visit"" AS t2 ON t1.""ID"" = t2.""visitor_ID"" JOIN ""museum"" AS t3 ON t3.""Museum_ID"" = t2.""Museum_ID"" WHERE t3.""Open_Year"" > '2011';",What is the name of the visitor who visited both a museum opened before 2009 and a museum opened after 2011?,0,0,0,4,2,2,53,21
190,7499,battle_death,"SELECT T1.id ,  T1.name FROM battle AS T1 JOIN ship AS T2 ON T1.id  =  T2.lost_in_battle JOIN death AS T3 ON T2.id  =  T3.caused_by_ship_id GROUP BY T1.id HAVING sum(T3.killed)  >  10",What are the ids and names of the battles that led to more than 10 people killed in total.,1,0,1,2,1,0,30,19
191,7936,dog_kennels,"SELECT T1.owner_id ,  T1.last_name FROM Owners AS T1 JOIN Dogs AS T2 ON T1.owner_id  =  T2.owner_id JOIN Treatments AS T3 ON T2.dog_id  =  T3.dog_id GROUP BY T1.owner_id ORDER BY count(*) DESC LIMIT 1",Which owner has paid for the most treatments on his or her dogs? List the owner id and last name.,0,1,1,2,1,0,32,20
192,7937,dog_kennels,"SELECT T1.owner_id ,  T1.last_name FROM Owners AS T1 JOIN Dogs AS T2 ON T1.owner_id  =  T2.owner_id JOIN Treatments AS T3 ON T2.dog_id  =  T3.dog_id GROUP BY T1.owner_id ORDER BY count(*) DESC LIMIT 1",Tell me the owner id and last name of the owner who spent the most on treatments of his or her dogs.,0,1,1,2,1,0,32,22
193,7940,dog_kennels,"SELECT T1.owner_id ,  T1.zip_code FROM Owners AS T1 JOIN Dogs AS T2 ON T1.owner_id  =  T2.owner_id JOIN Treatments AS T3 ON T2.dog_id  =  T3.dog_id GROUP BY T1.owner_id ORDER BY sum(T3.cost_of_treatment) DESC LIMIT 1",Which owner has paid the largest amount of money in total for their dogs? Show the owner id and zip code.,0,1,1,2,1,0,32,21
194,7941,dog_kennels,"SELECT T1.owner_id ,  T1.zip_code FROM Owners AS T1 JOIN Dogs AS T2 ON T1.owner_id  =  T2.owner_id JOIN Treatments AS T3 ON T2.dog_id  =  T3.dog_id GROUP BY T1.owner_id ORDER BY sum(T3.cost_of_treatment) DESC LIMIT 1",Find the owner id and zip code of the owner who spent the most money in total for his or her dogs.,0,1,1,2,1,0,32,22
195,7954,dog_kennels,"SELECT T1.name ,  T2.date_of_treatment FROM Dogs AS T1 JOIN Treatments AS T2 ON T1.dog_id  =  T2.dog_id WHERE T1.breed_code  =  ( SELECT breed_code FROM Dogs GROUP BY breed_code ORDER BY count(*) ASC LIMIT 1 )",List the names of the dogs of the rarest breed and the treatment dates of them.,0,1,1,1,2,1,33,16
196,7955,dog_kennels,"SELECT T1.name ,  T2.date_of_treatment FROM Dogs AS T1 JOIN Treatments AS T2 ON T1.dog_id  =  T2.dog_id WHERE T1.breed_code  =  ( SELECT breed_code FROM Dogs GROUP BY breed_code ORDER BY count(*) ASC LIMIT 1 )",Which dogs are of the rarest breed? Show their names and treatment dates.,0,1,1,1,2,1,33,13
