,qNL,true_SQL,qSQL,true_SQL_result,qSQL_result,equality
86,"display the employee number, name( first name and last name ), and salary for all employees who earn more than the average salary and who work in a department with any employee with a 'J' in their first name.","SELECT employee_id ,  first_name ,  last_name ,  salary FROM employees WHERE salary  >  ( SELECT AVG (salary) FROM employees ) AND department_id IN ( SELECT department_id FROM employees WHERE first_name LIKE '%J%')","SELECT e1.EMPLOYEE_ID, e1.FIRST_NAME, e1.LAST_NAME, e1.SALARY FROM employees e1 WHERE e1.SALARY > (SELECT AVG(SALARY) FROM employees) AND e1.DEPARTMENT_ID IN (     SELECT e2.DEPARTMENT_ID     FROM employees e2     WHERE e2.FIRST_NAME LIKE '%J%' );","[[Decimal('108'), 'Nancy', 'Greenberg', Decimal('12000.00')], [Decimal('109'), 'Daniel', 'Faviet', Decimal('9000.00')], [Decimal('110'), 'John', 'Chen', Decimal('8200.00')], [Decimal('111'), 'Ismael', 'Sciarra', Decimal('7700.00')], [Decimal('112'), 'Jose Manuel', 'Urman', Decimal('7800.00')], [Decimal('113'), 'Luis', 'Popp', Decimal('6900.00')], [Decimal('120'), 'Matthew', 'Weiss', Decimal('8000.00')], [Decimal('121'), 'Adam', 'Fripp', Decimal('8200.00')], [Decimal('122'), 'Payam', 'Kaufling', Decimal('7900.00')], [Decimal('123'), 'Shanta', 'Vollman', Decimal('6500.00')], [Decimal('145'), 'John', 'Russell', Decimal('14000.00')], [Decimal('146'), 'Karen', 'Partners', Decimal('13500.00')], [Decimal('147'), 'Alberto', 'Errazuriz', Decimal('12000.00')], [Decimal('148'), 'Gerald', 'Cambrault', Decimal('11000.00')], [Decimal('149'), 'Eleni', 'Zlotkey', Decimal('10500.00')], [Decimal('150'), 'Peter', 'Tucker', Decimal('10000.00')], [Decimal('151'), 'David', 'Bernstein', Decimal('9500.00')], [Decimal('152'), 'Peter', 'Hall', Decimal('9000.00')], [Decimal('153'), 'Christopher', 'Olsen', Decimal('8000.00')], [Decimal('154'), 'Nanette', 'Cambrault', Decimal('7500.00')], [Decimal('155'), 'Oliver', 'Tuvault', Decimal('7000.00')], [Decimal('156'), 'Janette', 'King', Decimal('10000.00')], [Decimal('157'), 'Patrick', 'Sully', Decimal('9500.00')], [Decimal('158'), 'Allan', 'McEwen', Decimal('9000.00')], [Decimal('159'), 'Lindsey', 'Smith', Decimal('8000.00')], [Decimal('160'), 'Louise', 'Doran', Decimal('7500.00')], [Decimal('161'), 'Sarath', 'Sewall', Decimal('7000.00')], [Decimal('162'), 'Clara', 'Vishney', Decimal('10500.00')], [Decimal('163'), 'Danielle', 'Greene', Decimal('9500.00')], [Decimal('164'), 'Mattea', 'Marvins', Decimal('7200.00')], [Decimal('165'), 'David', 'Lee', Decimal('6800.00')], [Decimal('168'), 'Lisa', 'Ozer', Decimal('11500.00')], [Decimal('169'), 'Harrison', 'Bloom', Decimal('10000.00')], [Decimal('170'), 'Tayler', 'Fox', Decimal('9600.00')], [Decimal('171'), 'William', 'Smith', Decimal('7400.00')], [Decimal('172'), 'Elizabeth', 'Bates', Decimal('7300.00')], [Decimal('174'), 'Ellen', 'Abel', Decimal('11000.00')], [Decimal('175'), 'Alyssa', 'Hutton', Decimal('8800.00')], [Decimal('176'), 'Jonathon', 'Taylor', Decimal('8600.00')], [Decimal('177'), 'Jack', 'Livingston', Decimal('8400.00')], [Decimal('178'), 'Kimberely', 'Grant', Decimal('7000.00')]]","[[Decimal('108'), 'Nancy', 'Greenberg', Decimal('12000.00')], [Decimal('109'), 'Daniel', 'Faviet', Decimal('9000.00')], [Decimal('110'), 'John', 'Chen', Decimal('8200.00')], [Decimal('111'), 'Ismael', 'Sciarra', Decimal('7700.00')], [Decimal('112'), 'Jose Manuel', 'Urman', Decimal('7800.00')], [Decimal('113'), 'Luis', 'Popp', Decimal('6900.00')], [Decimal('120'), 'Matthew', 'Weiss', Decimal('8000.00')], [Decimal('121'), 'Adam', 'Fripp', Decimal('8200.00')], [Decimal('122'), 'Payam', 'Kaufling', Decimal('7900.00')], [Decimal('123'), 'Shanta', 'Vollman', Decimal('6500.00')], [Decimal('145'), 'John', 'Russell', Decimal('14000.00')], [Decimal('146'), 'Karen', 'Partners', Decimal('13500.00')], [Decimal('147'), 'Alberto', 'Errazuriz', Decimal('12000.00')], [Decimal('148'), 'Gerald', 'Cambrault', Decimal('11000.00')], [Decimal('149'), 'Eleni', 'Zlotkey', Decimal('10500.00')], [Decimal('150'), 'Peter', 'Tucker', Decimal('10000.00')], [Decimal('151'), 'David', 'Bernstein', Decimal('9500.00')], [Decimal('152'), 'Peter', 'Hall', Decimal('9000.00')], [Decimal('153'), 'Christopher', 'Olsen', Decimal('8000.00')], [Decimal('154'), 'Nanette', 'Cambrault', Decimal('7500.00')], [Decimal('155'), 'Oliver', 'Tuvault', Decimal('7000.00')], [Decimal('156'), 'Janette', 'King', Decimal('10000.00')], [Decimal('157'), 'Patrick', 'Sully', Decimal('9500.00')], [Decimal('158'), 'Allan', 'McEwen', Decimal('9000.00')], [Decimal('159'), 'Lindsey', 'Smith', Decimal('8000.00')], [Decimal('160'), 'Louise', 'Doran', Decimal('7500.00')], [Decimal('161'), 'Sarath', 'Sewall', Decimal('7000.00')], [Decimal('162'), 'Clara', 'Vishney', Decimal('10500.00')], [Decimal('163'), 'Danielle', 'Greene', Decimal('9500.00')], [Decimal('164'), 'Mattea', 'Marvins', Decimal('7200.00')], [Decimal('165'), 'David', 'Lee', Decimal('6800.00')], [Decimal('168'), 'Lisa', 'Ozer', Decimal('11500.00')], [Decimal('169'), 'Harrison', 'Bloom', Decimal('10000.00')], [Decimal('170'), 'Tayler', 'Fox', Decimal('9600.00')], [Decimal('171'), 'William', 'Smith', Decimal('7400.00')], [Decimal('172'), 'Elizabeth', 'Bates', Decimal('7300.00')], [Decimal('174'), 'Ellen', 'Abel', Decimal('11000.00')], [Decimal('175'), 'Alyssa', 'Hutton', Decimal('8800.00')], [Decimal('176'), 'Jonathon', 'Taylor', Decimal('8600.00')], [Decimal('177'), 'Jack', 'Livingston', Decimal('8400.00')], [Decimal('178'), 'Kimberely', 'Grant', Decimal('7000.00')]]",TRUE
87,What are the top 3 artists with the largest number of songs in the language Bangla?,"SELECT T1.artist_name 
FROM artist AS T1 
JOIN song AS T2 ON T1.artist_name  =  T2.artist_name 
WHERE T2.languages  =  'bangla' 
GROUP BY T1.artist_name ORDER BY count(*) DESC LIMIT 3","SELECT artist_name, COUNT(*) as song_count FROM song WHERE languages = 'Bangla' GROUP BY artist_name ORDER BY song_count DESC LIMIT 3;","[['Farida'], ['Prity'], ['Shrikanta']]",[['None']],FALSE
88,List the brands of lenses that took both a picture of mountains with range 'Toubkal Atlas' and a picture of mountains with range 'Lasta Massif',SELECT T3.brand FROM mountain AS T1 JOIN photos AS T2 ON T1.id  =  T2.mountain_id JOIN camera_lens AS T3 ON T2.camera_lens_id  =  T3.id WHERE T1.range  =  'Toubkal Atlas' INTERSECT SELECT T3.brand FROM mountain AS T1 JOIN photos AS T2 ON T1.id  =  T2.mountain_id JOIN camera_lens AS T3 ON T2.camera_lens_id  =  T3.id WHERE T1.range  =  'Lasta Massif',"SELECT DISTINCT cl.brand FROM camera_lens cl JOIN photos p ON cl.id = p.camera_lens_id JOIN mountain m ON p.mountain_id = m.id WHERE m.range IN ('Toubkal Atlas', 'Lasta Massif') GROUP BY cl.brand HAVING COUNT(DISTINCT m.range) = 2;",[['Sigma']],[['Sigma']],TRUE
89,Which channels broadcast both in the morning and at night? Give me the channel names.,SELECT t1.name FROM channel AS t1 JOIN broadcast AS t2 ON t1.channel_id  =  t2.channel_id WHERE t2.time_of_day  =  'Morning' INTERSECT SELECT t1.name FROM channel AS t1 JOIN broadcast AS t2 ON t1.channel_id  =  t2.channel_id WHERE t2.time_of_day  =  'Night',"SELECT DISTINCT c.Name FROM channel c JOIN broadcast b ON c.Channel_ID = b.Channel_ID WHERE b.Time_of_day IN ('morning', 'night') GROUP BY c.Name HAVING COUNT(DISTINCT b.Time_of_day) = 2;",[['CCTV-1']],[['None']],FALSE
90,find the program owners that have some programs in both morning and night time.,SELECT t1.owner FROM program AS t1 JOIN broadcast AS t2 ON t1.program_id  =  t2.program_id WHERE t2.Time_of_day  =  'Morning' INTERSECT SELECT t1.owner FROM program AS t1 JOIN broadcast AS t2 ON t1.program_id  =  t2.program_id WHERE t2.Time_of_day  =  'Night',SELECT DISTINCT p.Owner FROM program p JOIN broadcast b ON p.Program_ID = b.Program_ID WHERE b.Time_of_day = 'morning' AND p.Program_ID IN (     SELECT p2.Program_ID     FROM program p2     JOIN broadcast b2 ON p2.Program_ID = b2.Program_ID     WHERE b2.Time_of_day = 'night' );,"[['Southern Media Corporation (SMC)'], ['Beijing Television (BTV)'], ['Hunan Broadcasting System (HBS)']]",[['None']],FALSE
91,"List the subject ID, name of subject and the number of courses available for each subject in ascending order of the course counts.","SELECT T1.subject_id ,  T2.subject_name ,  COUNT(*) 
FROM ""Courses"" AS T1 JOIN ""Subjects"" AS T2 ON T1.subject_id  =  T2.subject_id 
GROUP BY T1.subject_id, T2.subject_name  
ORDER BY COUNT(*) ASC","SELECT s.subject_id, s.subject_name, COUNT(c.course_id) AS number_of_courses FROM Subjects s LEFT JOIN Courses c ON s.subject_id = c.subject_id GROUP BY s.subject_id, s.subject_name ORDER BY number_of_courses ASC;","[[2, 'Arts', 4], [3, 'Language', 5], [1, 'Computer Science', 6]]",[['Error']],FALSE
92,Which claims caused more than 2 settlements or have the maximum claim value? List the date the claim was made and the claim id.,"SELECT T1.Date_Claim_Made ,  T1.Claim_id FROM Claims AS T1 JOIN Settlements AS T2 ON T1.Claim_id  =  T2.Claim_id GROUP BY T1.Claim_id HAVING count(*)  >  2 UNION SELECT T1.Date_Claim_Made ,  T1.Claim_id FROM Claims AS T1 JOIN Settlements AS T2 ON T1.Claim_id  =  T2.Claim_id WHERE T1.Amount_Claimed  =  ( SELECT max(Amount_Claimed) FROM Claims )","SELECT Claims.Claim_ID, Claims.Date_Claim_Made FROM Claims JOIN Settlements ON Claims.Claim_ID = Settlements.Claim_ID GROUP BY Claims.Claim_ID, Claims.Date_Claim_Made HAVING COUNT(Settlements.Settlement_ID) > 2 OR MAX(Claims.Amount_Claimed) = (SELECT MAX(Amount_Claimed) FROM Claims);","[[datetime.date(2017, 10, 21), 801], [datetime.date(2017, 8, 3), 571]]","[[571, datetime.date(2017, 8, 3)], [801, datetime.date(2017, 10, 21)]]",FALSE
93,Give me the the customer details and id for the customers who had two or more policies but did not file any claims.,"SELECT T1.customer_details ,  T1.customer_id FROM Customers AS T1 JOIN Customer_Policies AS T2 ON T1.Customer_id  =  T2.customer_id GROUP BY T1.customer_id HAVING count(*)  >=  2 EXCEPT SELECT T1.customer_details ,  T1.customer_id FROM Customers AS T1 JOIN Customer_Policies AS T2 ON T1.Customer_id  =  T2.customer_id JOIN Claims AS T3 ON T2.policy_id  =  T3.policy_id","SELECT Customers.Customer_Details, Customers.Customer_ID FROM Customers JOIN Customer_Policies ON Customers.Customer_ID = Customer_Policies.Customer_ID WHERE Customers.Customer_ID NOT IN (SELECT Customer_Policies.Customer_ID FROM Customer_Policies JOIN Claims ON Customer_Policies.Policy_ID = Claims.Policy_ID) GROUP BY Customers.Customer_ID, Customers.Customer_Details HAVING COUNT(Customer_Policies.Policy_ID) >= 2;","[['Dr. Diana Rath', 4]]","[['Dr. Diana Rath', 4]]",TRUE
94,"Among all the claims, what is the settlement amount of the claim with the largest claim amount? List both the settlement amount and claim amount.","SELECT Amount_Settled ,  Amount_Claimed FROM Claims ORDER BY Amount_Claimed DESC LIMIT 1","SELECT Amount_Claimed, Amount_Settled FROM Claims WHERE Amount_Claimed = (SELECT MAX(Amount_Claimed) FROM Claims);","[[1528, 89632]]","[[89632, 1528]]",FALSE
95,"Give me the claim date, settlement date for all the claims whose claimed amount is larger than the average.","SELECT Date_Claim_Made ,  Date_Claim_Settled FROM Claims WHERE Amount_Claimed  >  ( SELECT avg(Amount_Claimed) FROM Claims )","SELECT Date_Claim_Made, Date_Claim_Settled FROM Claims WHERE Amount_Claimed > (SELECT AVG(Amount_Claimed) FROM Claims);","[[datetime.date(2016, 8, 12), datetime.date(2018, 1, 27)], [datetime.date(2017, 2, 24), datetime.date(2018, 1, 21)], [datetime.date(2018, 6, 14), datetime.date(2017, 12, 20)], [datetime.date(2017, 8, 3), datetime.date(2018, 2, 18)], [datetime.date(2016, 8, 26), datetime.date(2017, 9, 4)], [datetime.date(2018, 7, 13), datetime.date(2017, 11, 22)]]","[[datetime.date(2016, 8, 12), datetime.date(2018, 1, 27)], [datetime.date(2017, 2, 24), datetime.date(2018, 1, 21)], [datetime.date(2018, 6, 14), datetime.date(2017, 12, 20)], [datetime.date(2017, 8, 3), datetime.date(2018, 2, 18)], [datetime.date(2016, 8, 26), datetime.date(2017, 9, 4)], [datetime.date(2018, 7, 13), datetime.date(2017, 11, 22)]]",TRUE
96,What are the first and last names of the first-grade students who are NOT taught by teacher OTHA MOYER?,"SELECT DISTINCT T1.firstname ,  T1.lastname FROM list AS T1 JOIN teachers AS T2 ON T1.classroom  =  T2.classroom WHERE T1.grade  =  1 EXCEPT SELECT T1.firstname ,  T1.lastname FROM list AS T1 JOIN teachers AS T2 ON T1.classroom  =  T2.classroom WHERE T2.firstname  =  'OTHA' AND T2.lastname  =  'MOYER'","SELECT list.FirstName, list.LastName FROM list LEFT JOIN teachers ON list.Classroom = teachers.Classroom WHERE list.Grade = 1 AND (teachers.LastName != 'OTHA' OR teachers.FirstName != 'MOYER');","[['RODGER', 'RANSLER'], ['MARCUS', 'RUNKLE'], ['ANTONY', 'BRIGHTBILL'], ['CHANTAL', 'HANNEMANN'], ['REYNALDO', 'BARTKUS'], ['KERI', 'TRAYWICK'], ['PATRINA', 'AMY']]","[['ANTONY', 'BRIGHTBILL'], ['KERI', 'TRAYWICK'], ['RODGER', 'RANSLER'], ['MARCUS', 'RUNKLE'], ['CHANTAL', 'HANNEMANN'], ['REYNALDO', 'BARTKUS'], ['PATRINA', 'AMY'], ['SHANAE', 'BIBB'], ['LANCE', 'HOOSOCK'], ['MEL', 'BALBOA'], ['ANIKA', 'YUEN'], ['EVELINA', 'BROMLEY']]",FALSE
97,Show the names of employees that work for companies with sales bigger than 200.,"SELECT T2.""Name""
FROM employment AS T1 
JOIN people AS T2 ON T1.""People_ID"" =  T2.""People_ID"" 
JOIN company AS T3 ON T1.""Company_ID""  =  T3.""Company_ID""
WHERE T3.""Sales_in_Billion""  >  200",SELECT people.Name FROM people JOIN employment ON people.People_ID = employment.People_ID JOIN company ON employment.Company_ID = company.Company_ID WHERE company.Sales_in_Billion > 200;,"[['Tom Sheehey'], ['Jerry Corcoran'], ['Darryl Kennedy']]",[['Error']],FALSE
98,"Who is the ""CTO"" of club ""Hopkins Student Enterprises""? Show the first name and last name.","SELECT t3.fname ,  t3.lname FROM club AS t1 JOIN member_of_club AS t2 ON t1.clubid  =  t2.clubid JOIN student AS t3 ON t2.stuid  =  t3.stuid WHERE t1.clubname  =  'Hopkins Student Enterprises' AND t2.position  =  'CTO'","SELECT Student.Fname, Student.LName FROM Student JOIN Member_of_club ON Student.StuID = Member_of_club.StuID JOIN Club ON Member_of_club.ClubID = Club.ClubID WHERE Member_of_club.Position = 'CTO' AND Club.ClubName = 'Hopkins Student Enterprises';","[['Jandy', 'Nelson']]","[['Jandy', 'Nelson']]",TRUE
99,Find the name and age of the person who is a friend of both Dan and Alice.,"SELECT T1.name ,  T1.age FROM Person AS T1 JOIN PersonFriend AS T2 ON T1.name  =  T2.name WHERE T2.friend  =  'Dan' INTERSECT SELECT T1.name ,   T1.age FROM Person AS T1 JOIN PersonFriend AS T2 ON T1.name  =  T2.name WHERE T2.friend  =  'Alice'","SELECT P.name, P.age FROM Person P JOIN PersonFriend PF ON P.name = PF.friend WHERE PF.name IN ('Dan', 'Alice') GROUP BY P.name, P.age HAVING COUNT(DISTINCT PF.name) = 2;","[['Zach', 45]]",[['None']],FALSE
100,"What are the names, ages, and jobs of all people who are friends with Alice for the longest amount of time?","SELECT T1.name ,  T1.age ,  T1.job FROM Person AS T1 JOIN PersonFriend AS T2 ON T1.name  =  T2.name WHERE T2.friend =  'Alice' AND T2.year  =  (SELECT max(YEAR) FROM PersonFriend WHERE friend =  'Alice')","SELECT P.name, P.age, P.job FROM Person P JOIN PersonFriend PF ON P.name = PF.friend WHERE PF.name = 'Alice' AND PF.year = (SELECT MIN(year) FROM PersonFriend WHERE name = 'Alice');","[['Zach', 45, 'doctor']]","[['Bob', 35, 'engineer']]",FALSE
101,Find Alice's friends of friends.,SELECT DISTINCT T4.name FROM PersonFriend AS T1 JOIN Person AS T2 ON T1.name  =  T2.name JOIN PersonFriend AS T3 ON T1.friend  =  T3.name JOIN PersonFriend AS T4 ON T3.friend  =  T4.name WHERE T2.name  =  'Alice' AND T4.name != 'Alice',SELECT pf2.friend  FROM PersonFriend pf1  JOIN PersonFriend pf2 ON pf1.friend = pf2.name  WHERE pf1.name = 'Alice';,[['Zach']],[['Zach']],TRUE
102,What are the names of documents that have both one of the three most common types and one of three most common structures?,"(SELECT document_name FROM documents 
GROUP BY document_type_code, document_name 
ORDER BY count(*) DESC LIMIT 3) 
INTERSECT 
(SELECT document_name FROM documents 
GROUP BY document_structure_code, document_name 
ORDER BY count(*) DESC LIMIT 3)",SELECT document_name FROM Documents WHERE document_type_code IN (     SELECT document_type_code     FROM Documents     GROUP BY document_type_code     ORDER BY COUNT(*) DESC     LIMIT 3 ) AND document_structure_code IN (     SELECT document_structure_code     FROM Documents     GROUP BY document_structure_code     ORDER BY COUNT(*) DESC     LIMIT 3 );,[['How to cook pasta']],"[['Learning English'], ['Learning Database'], ['Learning Japanese'], ['How to cook pasta'], ['Humanity: a fact'], ['Winter Sails'], ['Life about Claude Monet'], ['Relationships between History and Arts']]",FALSE
103,Find names of the document without any images.,SELECT document_name FROM documents EXCEPT SELECT t1.document_name FROM documents AS t1 JOIN document_sections AS t2 ON t1.document_code  =  t2.document_code JOIN document_sections_images AS t3 ON t2.section_id  =  t3.section_id,SELECT document_name  FROM Documents  WHERE document_code NOT IN (     SELECT document_code      FROM Document_Sections      WHERE section_id IN (         SELECT section_id          FROM Document_Sections_Images     ) );,"[['Learning Database'], ['Life about Claude Monet'], ['How to cook pasta'], ['Learning Japanese'], ['Humanity: a fact']]","[['Learning Database'], ['Learning Japanese'], ['How to cook pasta'], ['Humanity: a fact'], ['Life about Claude Monet']]",FALSE
104,Show the names of products that are in at least two events in ascending alphabetical order of product name.,SELECT T1.Product_Name FROM Products AS T1 JOIN Products_in_Events AS T2 ON T1.Product_ID  =  T2.Product_ID GROUP BY T1.Product_Name HAVING COUNT(*)  >=  2 ORDER BY T1.Product_Name,SELECT Product_Name FROM Products WHERE Product_ID IN (     SELECT Product_ID     FROM Products_in_Events     GROUP BY Product_ID     HAVING COUNT(Event_ID) >= 2 ) ORDER BY Product_Name ASC;,"[['Men suits'], ['Special Dinning'], ['TV Equipments']]","[['Men suits'], ['Special Dinning'], ['TV Equipments']]",TRUE
105,What are the name and payment method of customers who have both mailshots in 'Order' outcome and mailshots in 'No Response' outcome.,"SELECT T2.customer_name ,  T2.payment_method FROM mailshot_customers AS T1 JOIN customers AS T2 ON T1.customer_id  =  T2.customer_id WHERE T1.outcome_code  =  'Order' INTERSECT SELECT T2.customer_name ,  T2.payment_method FROM mailshot_customers AS T1 JOIN customers AS T2 ON T1.customer_id  =  T2.customer_id WHERE T1.outcome_code  =  'No Response'","SELECT DISTINCT c.customer_name, c.payment_method FROM Customers c JOIN Mailshot_Customers mc1 ON c.customer_id = mc1.customer_id JOIN Mailshot_Customers mc2 ON c.customer_id = mc2.customer_id WHERE mc1.outcome_code = 'Order' AND mc2.outcome_code = 'No Response';","[['Wendell', 'Credit Card'], ['Carlotta', 'Direct Debit']]","[['Carlotta', 'Direct Debit'], ['Wendell', 'Credit Card']]",FALSE
106,Find the name and address of the customers who have both New and Pending orders.,"SELECT T1.customer_name ,  T1.customer_address FROM customers AS T1 JOIN customer_orders AS T2 ON T1.customer_id  =  T2.customer_id WHERE T2.order_status_code  =  'New' INTERSECT SELECT T1.customer_name ,  T1.customer_address FROM customers AS T1 JOIN customer_orders AS T2 ON T1.customer_id  =  T2.customer_id WHERE T2.order_status_code  =  'Pending'","SELECT Customers.customer_name, Customers.customer_address FROM Customers JOIN Customer_Orders ON Customers.customer_id = Customer_Orders.customer_id WHERE Customer_Orders.order_status_code IN ('New', 'Pending') GROUP BY Customers.customer_id HAVING COUNT(DISTINCT Customer_Orders.order_status_code) = 2;","[['Lexus', '9581 Will Flat Suite 272\nEast Cathryn, WY 30751-4404']]","[['Lexus', '9581 Will Flat Suite 272\nEast Cathryn, WY 30751-4404']]",TRUE
107,What are the ids of all products that were either ordered more than 3 times or have a cumulative amount purchased of above 80000?,"SELECT product_id
FROM Order_Items
GROUP BY product_id
HAVING COUNT(*) > 3
UNION
SELECT product_id
FROM Product_Suppliers
GROUP BY product_id
HAVING SUM(CAST(total_amount_purchased AS numeric)) > 80000;",SELECT product_id  FROM Order_Items  GROUP BY product_id  HAVING COUNT(order_id) > 3  UNION  SELECT product_id  FROM Product_Suppliers  WHERE CAST(total_amount_purchased AS INTEGER) > 80000;,"[[5], [4], [8]]",[['Error']],FALSE
108,What are the distinct names of customers who have purchased a keyboard?,SELECT DISTINCT T1.customer_name FROM customers AS T1 JOIN customer_orders AS T2 ON T1.customer_id  =  T2.customer_id JOIN order_items AS T3 ON T2.order_id  =  T3.order_id JOIN products AS T4 ON T3.product_id  =  T4.product_id WHERE T4.product_name  =  'keyboard',SELECT DISTINCT Customers.customer_name FROM Customers JOIN Customer_Orders ON Customers.customer_id = Customer_Orders.customer_id JOIN Order_Items ON Customer_Orders.order_id = Order_Items.order_id JOIN Products ON Order_Items.product_id = Products.product_id WHERE Products.product_name = 'keyboard';,"[['Cordell'], ['Jon']]","[['Cordell'], ['Jon']]",TRUE
109,Find the name and gender of the staff who has been assigned the job of Sales Person but never Clerical Staff.,"SELECT T1.staff_name ,  T1.staff_gender FROM staff AS T1 JOIN Staff_Department_Assignments AS T2 ON T1.staff_id  =  T2.staff_id WHERE T2.job_title_code  =  'Sales Person' EXCEPT SELECT T1.staff_name ,  T1.staff_gender FROM staff AS T1 JOIN Staff_Department_Assignments AS T2 ON T1.staff_id  =  T2.staff_id WHERE T2.job_title_code  =  'Clerical Staff'","SELECT Staff.staff_name, Staff.staff_gender FROM Staff INNER JOIN Staff_Department_Assignments ON Staff.staff_id = Staff_Department_Assignments.staff_id WHERE Staff_Department_Assignments.job_title_code = 'Sales Person' AND Staff.staff_id NOT IN (     SELECT Staff.staff_id     FROM Staff     INNER JOIN Staff_Department_Assignments ON Staff.staff_id = Staff_Department_Assignments.staff_id     WHERE Staff_Department_Assignments.job_title_code = 'Clerical Staff' );","[['Melody', '1'], ['Sabrina', '1'], ['Zakary', '1']]","[['Zakary', '1'], ['Sabrina', '1'], ['Melody', '1']]",FALSE
110,"Please show the names of aircrafts associated with airport with name ""London Gatwick"".","SELECT T1.""Aircraft"" FROM aircraft AS T1 JOIN airport_aircraft AS T2 ON T1.""Aircraft_ID""  =  T2.""Aircraft_ID"" JOIN airport AS T3 ON T2.""Airport_ID""  =  T3.""Airport_ID"" WHERE T3.""Airport_Name""  =  'London Gatwick'",SELECT aircraft.Aircraft FROM aircraft JOIN airport_aircraft ON aircraft.Aircraft_ID = airport_aircraft.Aircraft_ID JOIN airport ON airport_aircraft.Airport_ID = airport.Airport_ID WHERE airport.Airport_Name = 'London Gatwick';,[['Robinson R-22']],[['Error']],FALSE
111,find the name and age of the pilot who has won the most number of times among the pilots who are younger than 30.,"SELECT t1.""Name"" ,  t1.""Age"" 
FROM pilot AS t1 
JOIN MATCH AS t2 ON t1.""Pilot_Id""  =  t2.""Winning_Pilot"" 
WHERE t1.""Age""  <  30 
GROUP BY t1.""Name"" ,  t1.""Age"" 
ORDER BY count(*) DESC LIMIT 1","SELECT p.""Name"", p.""Age"" FROM pilot p WHERE p.""Pilot_Id"" = (   SELECT m.""Winning_Pilot""   FROM match m   WHERE m.""Winning_Pilot"" IN (     SELECT ""Pilot_Id""     FROM pilot     WHERE ""Age"" < 30   )   GROUP BY m.""Winning_Pilot""   ORDER BY COUNT(*) DESC   LIMIT 1 );","[['Ayana Spencer', 25]]","[['Ayana Spencer', 25]]",TRUE
112,"How many services has each resident requested? List the resident id, details, and the count in descending order of the count.","SELECT T1.resident_id ,  T1.other_details ,  count(*) 
FROM Residents AS T1 
JOIN Residents_Services AS T2 ON T1.resident_id  =  T2.resident_id 
GROUP BY T1.resident_id, T1.other_details  
ORDER BY count(*) DESC","SELECT resident_id, other_details, COUNT(service_id) AS service_count FROM Residents_Services GROUP BY resident_id, other_details ORDER BY service_count DESC;","[[28, 'Miss Alanis Lockman', 1], [87, 'Mrs. Raphaelle Fisher', 1], [67, 'Terrill Bernhard', 1], [6, 'Anderson Batz', 1], [45, 'Prof. Nasir Hoppe', 1], [47, 'Tiffany Jaskolski', 1], [43, 'Elroy Schuster', 1], [90, 'Cassie Johnson', 1], [88, 'Jacques Glover II', 1], [23, 'Jess Wyman', 1], [83, 'Loy Walter', 1]]","[[47, 'Unsatisfied', 1], [43, 'Unsatisfied', 1], [6, 'Satisfied', 1], [87, 'Unsatisfied', 1], [83, 'Unsatisfied', 1], [67, 'Unsatisfied', 1], [88, 'Unsatisfied', 1], [45, 'Unsatisfied', 1], [23, 'Unsatisfied', 1], [28, 'Unsatisfied', 1], [90, 'Unsatisfied', 1]]",FALSE
113,"Which city is the headquarter of the store named ""Blackville"" in?","SELECT t3.""Headquartered_City"" 
FROM store AS t1 
JOIN store_district AS t2 ON t1.""Store_ID"" =  t2.""Store_ID"" 
JOIN district AS t3 ON t2.""District_ID""  =  t3.""District_ID"" 
WHERE t1.""Store_Name""  =  'Blackville'",SELECT district.Headquartered_City FROM district JOIN store_district ON district.District_ID = store_district.District_ID JOIN store ON store_district.Store_ID = store.Store_ID WHERE store.Store_Name = 'Blackville';,[['Bhakkar City']],[['Error']],FALSE
114,Find the number of stores in each city.,"SELECT t3.""Headquartered_City"" ,  count(*) 
FROM store AS t1 
JOIN store_district AS t2 ON t1.""Store_ID""  =  t2.""Store_ID""
JOIN district AS t3 ON t2.""District_ID""  =  t3.""District_ID""
GROUP BY t3.""Headquartered_City""","SELECT d.Headquartered_City, COUNT(s.Store_ID)  FROM district d  JOIN store_district sd ON d.District_ID = sd.District_ID  JOIN store s ON sd.Store_ID = s.Store_ID  GROUP BY d.Headquartered_City;","[['Hafizabad City', 1], ['Bhakkar City', 1], ['Bahawalpur City', 1], ['Khanewal City', 2]]",[['Error']],FALSE
