,qNL,true_SQL,qSQL,true_SQL_result,qSQL_result,equality
115,How many stores are headquarted in each city?,"SELECT t3.""Headquartered_City"" ,  count(*) 
FROM store AS t1 
JOIN store_district AS t2 ON t1.""Store_ID""  =  t2.""Store_ID""
JOIN district AS t3 ON t2.""District_ID""  =  t3.""District_ID"" 
GROUP BY t3.""Headquartered_City""","SELECT d.Headquartered_City, COUNT(s.Store_ID)  FROM district d  JOIN store_district sd ON d.District_ID = sd.District_ID  JOIN store s ON sd.Store_ID = s.Store_ID  GROUP BY d.Headquartered_City;","[['Hafizabad City', 1], ['Bhakkar City', 1], ['Bahawalpur City', 1], ['Khanewal City', 2]]",[['Error']],FALSE
116,Find the city with the most number of stores.,"SELECT t3.""Headquartered_City""
FROM store AS t1 
JOIN store_district AS t2 ON t1.""Store_ID""  =  t2.""Store_ID""
JOIN district AS t3 ON t2.""District_ID""  =  t3.""District_ID"" 
GROUP BY t3.""Headquartered_City""
ORDER BY count(*) DESC LIMIT 1","SELECT ""Headquartered_City"" FROM ""district"" JOIN ""store_district"" ON ""district"".""District_ID"" = ""store_district"".""District_ID"" GROUP BY ""Headquartered_City"" ORDER BY COUNT(""store_district"".""Store_ID"") DESC LIMIT 1;",[['Khanewal City']],[['Khanewal City']],TRUE
117,What is the city with the most number of flagship stores?,"SELECT t3.""Headquartered_City"" FROM ""store"" AS t1 JOIN ""store_district"" AS t2 ON t1.""Store_ID"" = t2.""Store_ID"" JOIN ""district"" AS t3 ON t2.""District_ID"" = t3.""District_ID"" GROUP BY t3.""Headquartered_City"" ORDER BY count(*) DESC LIMIT 1","SELECT ""Headquartered_City"" FROM ""district"" JOIN ""store_district"" ON ""district"".""District_ID"" = ""store_district"".""District_ID"" JOIN ""store"" ON ""store_district"".""Store_ID"" = ""store"".""Store_ID"" WHERE ""store"".""Type"" = 'flagship' GROUP BY ""Headquartered_City"" ORDER BY COUNT(*) DESC LIMIT 1;",[['Khanewal City']],[['None']],FALSE
118,Find the names of districts where have both city mall and village store type stores.,"SELECT t3.""District_name"" FROM ""store"" AS t1 JOIN ""store_district"" AS t2 ON t1.""Store_ID"" = t2.""Store_ID"" JOIN ""district"" AS t3 ON t2.""District_ID"" = t3.""District_ID"" WHERE t1.""Type"" = 'City Mall' INTERSECT SELECT t3.""District_name"" FROM store AS t1 JOIN ""store_district"" AS t2 ON t1.""Store_ID"" = t2.""Store_ID"" JOIN ""district"" AS t3 ON t2.""District_ID"" = t3.""District_ID"" WHERE t1.""Type"" = 'Village Store';","SELECT DISTINCT d.District_name FROM district d JOIN store_district sd ON d.District_ID = sd.District_ID JOIN store s ON sd.Store_ID = s.Store_ID WHERE s.Type IN ('city mall', 'village store') GROUP BY d.District_name HAVING COUNT(DISTINCT s.Type) = 2;",[['Khanewal District']],[['Error']],FALSE
119,What are the names of the districts that have both mall and village store style shops?,"SELECT t3.""District_name"" FROM ""store"" AS t1 JOIN ""store_district"" AS t2 ON t1.""Store_ID"" = t2.""Store_ID"" JOIN ""district"" AS t3 ON t2.""District_ID"" = t3.""District_ID"" WHERE t1.""Type"" = 'City Mall' INTERSECT SELECT t3.""District_name"" FROM store AS t1 JOIN ""store_district"" AS t2 ON t1.""Store_ID"" = t2.""Store_ID"" JOIN ""district"" AS t3 ON t2.""District_ID"" = t3.""District_ID"" WHERE t1.""Type"" = 'Village Store';","SELECT DISTINCT d.District_name FROM district d JOIN store_district sd ON d.District_ID = sd.District_ID JOIN store s ON sd.Store_ID = s.Store_ID WHERE s.Type IN ('mall', 'village') GROUP BY d.District_name HAVING COUNT(DISTINCT s.Type) = 2;",[['Khanewal District']],[['Error']],FALSE
120,Find the names of states that have some college students playing in goalie and mid positions.,SELECT T1.state FROM college AS T1 JOIN tryout AS T2 ON T1.cName  =  T2.cName WHERE T2.pPos  =  'goalie' INTERSECT SELECT T1.state FROM college AS T1 JOIN tryout AS T2 ON T1.cName  =  T2.cName WHERE T2.pPos  =  'mid',"SELECT DISTINCT College.state FROM College JOIN Tryout ON College.cName = Tryout.cName WHERE Tryout.pPos IN ('goalie', 'mid');",[['LA']],"[['AZ'], ['LA'], ['OK']]",FALSE
121,What are the names of the states that have some college students playing in the positions of goalie and mid-field?,SELECT T1.state FROM college AS T1 JOIN tryout AS T2 ON T1.cName  =  T2.cName WHERE T2.pPos  =  'goalie' INTERSECT SELECT T1.state FROM college AS T1 JOIN tryout AS T2 ON T1.cName  =  T2.cName WHERE T2.pPos  =  'mid',"SELECT DISTINCT College.state FROM College JOIN Tryout ON College.cName = Tryout.cName WHERE Tryout.pPos IN ('goalie', 'mid-field');",[['LA']],"[['AZ'], ['LA']]",FALSE
122,Find the names of states that have some college students playing in the mid position but not in the goalie position.,SELECT T1.state FROM college AS T1 JOIN tryout AS T2 ON T1.cName  =  T2.cName WHERE T2.pPos  =  'mid' EXCEPT SELECT T1.state FROM college AS T1 JOIN tryout AS T2 ON T1.cName  =  T2.cName WHERE T2.pPos  =  'goalie',SELECT DISTINCT state  FROM College  WHERE cName IN (     SELECT cName      FROM Tryout      WHERE pPos = 'mid'  )  AND cName NOT IN (     SELECT cName      FROM Tryout      WHERE pPos = 'goalie' );,[['OK']],[['OK']],TRUE
123,What are the names of all the states with college students playing in the mid position but no goalies?,SELECT T1.state FROM college AS T1 JOIN tryout AS T2 ON T1.cName  =  T2.cName WHERE T2.pPos  =  'mid' EXCEPT SELECT T1.state FROM college AS T1 JOIN tryout AS T2 ON T1.cName  =  T2.cName WHERE T2.pPos  =  'goalie',SELECT DISTINCT c.state FROM College c JOIN Tryout t ON c.cName = t.cName WHERE t.pPos = 'mid' AND c.cName NOT IN (   SELECT c.cName   FROM College c   JOIN Tryout t ON c.cName = t.cName   WHERE t.pPos = 'goalie' );,[['OK']],[['OK']],TRUE
124,How many states that have some college students playing in the mid position but not in the goalie position.,SELECT COUNT(*) FROM (SELECT T1.state FROM college AS T1 JOIN tryout AS T2 ON T1.cName  =  T2.cName WHERE T2.pPos  =  'mid' EXCEPT SELECT T1.state FROM college AS T1 JOIN tryout AS T2 ON T1.cName  =  T2.cName WHERE T2.pPos  =  'goalie') as T,SELECT COUNT(DISTINCT c.state)  FROM College c  JOIN Tryout t ON c.cName = t.cName  WHERE t.pPos = 'mid'  AND c.cName NOT IN (   SELECT cName    FROM Tryout    WHERE pPos = 'goalie' );,[[1]],[[1]],TRUE
125,What is the count of states with college students playing in the mid position but not as goalies?,SELECT COUNT(*) FROM (SELECT T1.state FROM college AS T1 JOIN tryout AS T2 ON T1.cName  =  T2.cName WHERE T2.pPos  =  'mid' EXCEPT SELECT T1.state FROM college AS T1 JOIN tryout AS T2 ON T1.cName  =  T2.cName WHERE T2.pPos  =  'goalie') as T,SELECT COUNT(DISTINCT c.state)  FROM College c  JOIN Tryout t ON c.cName = t.cName  WHERE t.pPos = 'mid' AND t.pID NOT IN  (SELECT pID FROM Tryout WHERE pPos = 'goalie');,[[1]],[[2]],FALSE
126,Show names of shops and the carriers of devices they have in stock.,"SELECT T3.""Shop_Name"", T2.""Carrier"" 
FROM ""stock"" AS T1 JOIN ""device"" AS T2 ON T1.""Device_ID"" = T2.""Device_ID"" 
JOIN ""shop"" AS T3 ON T1.""Shop_ID"" = T3.""Shop_ID""","SELECT shop.Shop_Name, device.Carrier FROM shop JOIN stock ON shop.Shop_ID = stock.Shop_ID JOIN device ON stock.Device_ID = device.Device_ID;","[['Dinas Device', 'Vodafone AU'], ['Best Buy', 'Vodafone AU'], ['Ferndale', 'Vodafone AU'], ['Apple', 'Vodafone AU'], ['Dinas Device', 'Bell Mobility'], ['ATnT', 'Vodafone AU'], ['Ferndale', 'Bell Mobility'], ['Gelli repair', 'Bell Mobility']]",[['Error']],FALSE
127,Show the name of the shop that has the most kind of devices in stock.,"SELECT T2.""Shop_Name"" FROM ""stock"" AS T1 JOIN ""shop"" AS T2 ON T1.""Shop_ID"" = T2.""Shop_ID"" GROUP BY T1.""Shop_ID"", T2.""Shop_Name"" ORDER BY COUNT(*) DESC LIMIT 1","SELECT ""Shop_Name"" FROM ""shop"" JOIN ""stock"" ON ""shop"".""Shop_ID"" = ""stock"".""Shop_ID"" GROUP BY ""Shop_Name"" ORDER BY COUNT(DISTINCT ""Device_ID"") DESC LIMIT 1;",[['Dinas Device']],[['Dinas Device']],TRUE
128,Which product has the most problems? Give me the number of problems and the product name.,"SELECT count(*) ,  T1.product_name FROM product AS T1 JOIN problems AS T2 ON T1.product_id = T2.product_id GROUP BY T1.product_name ORDER BY count(*) DESC LIMIT 1","SELECT product_name, COUNT(*) AS number_of_problems FROM Product JOIN Problems ON Product.product_id = Problems.product_id GROUP BY product_name ORDER BY number_of_problems DESC LIMIT 1;","[[4, 'rose']]","[['rose', 4]]",FALSE
129,What are the product ids for the problems reported by Christop Berge with closure authorised by Ashley Medhurst?,SELECT product_id FROM problems AS T1 JOIN staff AS T2 ON T1.reported_by_staff_id = T2.staff_id WHERE T2.staff_first_name = 'Christop' AND T2.staff_last_name = 'Berge' INTERSECT SELECT product_id FROM problems AS T1 JOIN staff AS T2 ON T1.closure_authorised_by_staff_id = T2.staff_id WHERE T2.staff_first_name = 'Ashley' AND T2.staff_last_name = 'Medhurst',SELECT product_id  FROM Problems  JOIN Staff AS reported_by ON Problems.reported_by_staff_id = reported_by.staff_id  JOIN Staff AS authorised_by ON Problems.closure_authorised_by_staff_id = authorised_by.staff_id  WHERE reported_by.staff_first_name = 'Christop' AND reported_by.staff_last_name = 'Berge'  AND authorised_by.staff_first_name = 'Ashley' AND authorised_by.staff_last_name = 'Medhurst';,[[8]],[[8]],TRUE
130,What are the names of the members and branches at which they are registered sorted by year of registration?,"SELECT T3.name ,  T2.name FROM membership_register_branch AS T1 JOIN branch AS T2 ON T1.branch_id  =  T2.branch_id JOIN member AS T3 ON T1.member_id  =  T3.member_id ORDER BY T1.register_year","SELECT member.Name, branch.Name, membership_register_branch.Register_Year FROM member JOIN membership_register_branch ON member.Member_ID = membership_register_branch.Member_ID JOIN branch ON membership_register_branch.Branch_ID = branch.Branch_ID ORDER BY membership_register_branch.Register_Year;","[['Trevard Lindley', 'Brooke Greville'], ['Myron Pryor', 'Zytogorski'], ['Johnny Williams', 'Popert'], ['Jeremy Jarmon', 'Stanley'], ['Ventrell Jenkins', 'Alexandre'], ['Braxton Kelley', 'Cochrane'], ['Corey Peters', 'Alexandre'], ['Micah Johnson', 'Taverner']]","[['Trevard Lindley', 'Brooke Greville', '2016'], ['Myron Pryor', 'Zytogorski', '2016'], ['Johnny Williams', 'Popert', '2016'], ['Jeremy Jarmon', 'Stanley', '2016'], ['Ventrell Jenkins', 'Alexandre', '2016'], ['Braxton Kelley', 'Cochrane', '2016'], ['Corey Peters', 'Alexandre', '2017'], ['Micah Johnson', 'Taverner', '2017']]",FALSE
131,What is the name and opening year for the branch that registered the most members in 2016?,"SELECT T2.name ,T2.open_year FROM membership_register_branch AS T1 JOIN branch AS T2 ON T1.branch_id = T2.branch_id WHERE T1.register_year = '2016' GROUP BY T2.branch_id ORDER BY count(*) DESC LIMIT 1","SELECT branch.Name, branch.Open_year FROM branch JOIN membership_register_branch ON branch.Branch_ID = membership_register_branch.Branch_ID WHERE membership_register_branch.Register_Year = '2016' GROUP BY branch.Branch_ID ORDER BY COUNT(membership_register_branch.Member_ID) DESC LIMIT 1;","[['Alexandre', '2001']]","[['Alexandre', '2001']]",TRUE
132,What are the product ids and color descriptions for products with two or more characteristics?,"SELECT t1.product_id, t2.color_description FROM products AS t1 JOIN ref_colors AS t2 ON t1.color_code = t2.color_code JOIN product_characteristics AS t3 ON t1.product_id = t3.product_id GROUP BY t1.product_id, t2.color_description HAVING count(*) >= 2","SELECT P.product_id, C.color_description FROM Products P JOIN Ref_Colors C ON P.color_code = C.color_code WHERE P.product_id IN (     SELECT PC.product_id     FROM Product_Characteristics PC     GROUP BY PC.product_id     HAVING COUNT(PC.characteristic_id) >= 2 )","[[6, 'blue'], [7, 'red'], [11, 'black'], [12, 'blue']]","[[7, 'red'], [12, 'blue'], [6, 'blue'], [11, 'black']]",FALSE
133,Show the names of customers who use Credit Card payment method and have more than 2 orders.,SELECT T1.customer_name FROM customers AS T1 JOIN customer_orders AS T2 ON T1.customer_id  =  T2.customer_id WHERE T1.payment_method_code  =  'Credit Card' GROUP BY T1.customer_id HAVING count(*)  >  2,SELECT c.customer_name FROM Customers c JOIN Customer_Orders co ON c.customer_id = co.customer_id WHERE c.payment_method_code = 'Credit Card' GROUP BY c.customer_name HAVING COUNT(co.order_id) > 2;,"[['Sterling'], ['Cleo']]","[['Cleo'], ['Sterling']]",FALSE
134,What are the name and phone of the customer with the most ordered product quantity?,"SELECT T1.customer_name, T1.customer_phone FROM customers AS T1 JOIN customer_orders AS T2 ON T1.customer_id = T2.customer_id JOIN order_items AS T3 ON T3.order_id = T2.order_id GROUP BY T1.customer_id ORDER BY SUM(CAST(t3.order_quantity AS integer)) DESC LIMIT 1","SELECT c.customer_name, c.customer_phone FROM Customers c JOIN Customer_Orders co ON c.customer_id = co.customer_id JOIN Order_Items oi ON co.order_id = oi.order_id GROUP BY c.customer_id ORDER BY SUM(oi.order_quantity::INTEGER) DESC LIMIT 1;","[['Cleo', '1-202-928-5395']]","[['Cleo', '1-202-928-5395']]",TRUE
135,What is the name of the dorm with both a TV Lounge and Study Room listed as amenities?,SELECT T1.dorm_name FROM dorm AS T1 JOIN has_amenity AS T2 ON T1.dormid  =  T2.dormid JOIN dorm_amenity AS T3 ON T2.amenid  =  T3.amenid WHERE T3.amenity_name  =  'TV Lounge' INTERSECT SELECT T1.dorm_name FROM dorm AS T1 JOIN has_amenity AS T2 ON T1.dormid  =  T2.dormid JOIN dorm_amenity AS T3 ON T2.amenid  =  T3.amenid WHERE T3.amenity_name  =  'Study Room',"SELECT Dorm.dorm_name FROM Dorm JOIN Has_amenity ON Dorm.dormid = Has_amenity.dormid JOIN Dorm_amenity ON Has_amenity.amenid = Dorm_amenity.amenid WHERE Dorm_amenity.amenity_name IN ('TV Lounge', 'Study Room') GROUP BY Dorm.dorm_name HAVING COUNT(DISTINCT Dorm_amenity.amenity_name) = 2;","[['Dorm-plex 2000'], ['Anonymous Donor Hall']]","[['Anonymous Donor Hall'], ['Dorm-plex 2000']]",FALSE
136,Find the first name of students who are living in the dorm that has most number of amenities.,SELECT T1.fname FROM student AS T1 JOIN lives_in AS T2 ON T1.stuid  =  T2.stuid WHERE T2.dormid IN (SELECT T2.dormid FROM dorm AS T3 JOIN has_amenity AS T4 ON T3.dormid  =  T4.dormid JOIN dorm_amenity AS T5 ON T4.amenid  =  T5.amenid GROUP BY T3.dormid ORDER BY count(*) DESC LIMIT 1),SELECT Fname  FROM Student  WHERE StuID IN (     SELECT stuid      FROM Lives_in      WHERE dormid IN (         SELECT dormid          FROM Has_amenity          GROUP BY dormid          ORDER BY COUNT(amenid) DESC          LIMIT 1     ) );,"[['Linda'], ['Tracy'], ['Shiela'], ['Dinesh'], ['Paul'], ['Lisa'], ['Jandy'], ['Eric'], ['Derek'], ['David'], ['Steven'], ['Charles'], ['Susan'], ['Mark'], ['Bruce'], ['Michael'], ['Ian'], ['George'], ['Michael'], ['David'], ['Stacy'], ['Mark'], ['Paul'], ['Eric'], ['Jun'], ['Lisa'], ['Sarah'], ['Eric'], ['William'], ['Eric'], ['Sarah']]","[['Ian'], ['Susan'], ['Mark'], ['George'], ['Jandy'], ['Derek'], ['Paul'], ['Eric'], ['David'], ['Steven']]",FALSE
137,What are the amenities in the dorm that a student who has the last name of Smith lives in?,SELECT T3.amenity_name FROM dorm AS T1 JOIN has_amenity AS T2 ON T1.dormid  =  T2.dormid JOIN dorm_amenity AS T3 ON T2.amenid  =  T3.amenid JOIN lives_in AS T4 ON T4.dormid  =  T1.dormid JOIN student AS T5 ON T5.stuid  =  T4.stuid WHERE T5.lname  =  'Smith',SELECT Dorm_amenity.amenity_name FROM Dorm_amenity JOIN Has_amenity ON Dorm_amenity.amenid = Has_amenity.amenid JOIN Lives_in ON Has_amenity.dormid = Lives_in.dormid JOIN Student ON Lives_in.stuid = Student.StuID WHERE Student.LName = 'Smith';,"[['TV Lounge'], ['Study Room'], ['Carpeted Rooms'], ['4 Walls'], ['Roof'], ['Ethernet Ports'], ['Air Conditioning'], ['Heat'], ['Study Room'], ['Carpeted Rooms'], ['4 Walls'], ['Roof'], ['Heat']]","[['TV Lounge'], ['Study Room'], ['Carpeted Rooms'], ['4 Walls'], ['Roof'], ['Ethernet Ports'], ['Air Conditioning'], ['Heat'], ['Study Room'], ['Carpeted Rooms'], ['4 Walls'], ['Roof'], ['Heat']]",TRUE
138,What are the emails of customers who have filed complaints on the product which has had the greatest number of complaints?,SELECT t1.email_address FROM customers AS t1 JOIN complaints AS t2 ON t1.customer_id  =  t2.customer_id GROUP BY t1.customer_id ORDER BY count(*) LIMIT 1,SELECT c.email_address FROM Customers c JOIN Complaints com ON c.customer_id = com.customer_id WHERE com.product_id = (     SELECT product_id     FROM Complaints     GROUP BY product_id     ORDER BY COUNT(*) DESC     LIMIT 1 );,[['ubeier@example.org']],"[['cayla.satterfield@example.net'], ['vbogisich@example.org'], ['vbogisich@example.org'], ['ubeier@example.org'], ['lavonne.frami@example.com'], ['rzulauf@example.org']]",FALSE
139,Which products has been complained by the customer who has filed least amount of complaints?,"SELECT t1.product_name FROM products AS t1 JOIN complaints AS t2 ON t1.product_id = t2.product_id JOIN customers AS t3 ON t2.customer_id = t3.customer_id GROUP BY t3.customer_id, t1.product_name ORDER BY COUNT(*) LIMIT 1",SELECT P.product_name FROM Products P JOIN Complaints C ON P.product_id = C.product_id WHERE C.customer_id = (     SELECT customer_id     FROM Complaints     GROUP BY customer_id     ORDER BY COUNT(*) ASC     LIMIT 1 );,[['Mouse']],[['The Great Gatsby']],FALSE
140,Return the names of products that have had complaints filed by the customer who has filed the fewest complaints.,"SELECT t1.product_name FROM products AS t1 JOIN complaints AS t2 ON t1.product_id = t2.product_id JOIN customers AS t3 ON t2.customer_id = t3.customer_id GROUP BY t3.customer_id, t1.product_name ORDER BY COUNT(*) LIMIT 1",SELECT P.product_name FROM Products P JOIN Complaints C ON P.product_id = C.product_id WHERE C.customer_id = (     SELECT customer_id     FROM Complaints     GROUP BY customer_id     ORDER BY COUNT(*) ASC     LIMIT 1 );,[['Mouse']],[['The Great Gatsby']],FALSE
141,What are the names of the tourist attractions and the dates when the tourists named Vincent or Vivian visited there?,"SELECT T1.Name, T3.Visit_Date FROM Tourist_Attractions AS T1 JOIN VISITS AS T3 ON T1.Tourist_Attraction_ID = T3.Tourist_Attraction_ID JOIN VISITORS AS T2 ON T2.Tourist_ID = T3.Tourist_ID WHERE T2.Tourist_Details = 'Vincent' OR T2.Tourist_Details = 'Vivian'","SELECT Tourist_Attractions.Name, Visits.Visit_Date FROM Tourist_Attractions JOIN Visits ON Tourist_Attractions.Tourist_Attraction_ID = Visits.Tourist_Attraction_ID JOIN Visitors ON Visits.Tourist_ID = Visitors.Tourist_ID WHERE Visitors.Tourist_Details LIKE 'Vincent%' OR Visitors.Tourist_Details LIKE 'Vivian%';","[['flying elephant', Timestamp('2013-08-06 05:35:51')], ['fun shops', Timestamp('2013-10-27 09:56:08')], ['fun games', Timestamp('2017-03-19 08:48:19')], ['parking', Timestamp('2007-09-17 10:12:45')]]","[['flying elephant', Timestamp('2013-08-06 05:35:51')], ['fun shops', Timestamp('2013-10-27 09:56:08')], ['fun games', Timestamp('2017-03-19 08:48:19')], ['parking', Timestamp('2007-09-17 10:12:45')]]",TRUE
142,Find the tourist attractions that have parking or shopping as their feature details. What are the names of the attractions?,SELECT T1.Name FROM Tourist_Attractions AS T1 JOIN Tourist_Attraction_Features AS T2 ON T1.tourist_attraction_id  =  T2.tourist_attraction_id JOIN Features AS T3 ON T2.Feature_ID  =  T3.Feature_ID WHERE T3.feature_Details  =  'park' UNION SELECT T1.Name FROM Tourist_Attractions AS T1 JOIN Tourist_Attraction_Features AS T2 ON T1.tourist_attraction_id  =  T2.tourist_attraction_id JOIN Features AS T3 ON T2.Feature_ID  =  T3.Feature_ID WHERE T3.feature_Details  =  'shopping',"SELECT ta.Name FROM Tourist_Attractions AS ta JOIN Tourist_Attraction_Features AS taf ON ta.Tourist_Attraction_ID = taf.Tourist_Attraction_ID JOIN Features AS f ON taf.Feature_ID = f.Feature_ID WHERE f.Feature_Details IN ('parking', 'shopping');","[['US museum'], ['impressions de France'], ['flying elephant'], ['cafe'], ['parking'], ['jungle cruise'], ['fun games'], ['exploration trial'], ['presidents hall']]","[['flying elephant'], ['film festival'], ['US museum'], ['US museum'], ['exploration trial'], ['presidents hall'], ['jungle cruise'], ['cafe'], ['parking']]",FALSE
143,Give me the name of the customer who ordered the most items in total.,SELECT t1.customer_name FROM customers AS t1 JOIN customer_orders AS t2 ON t1.customer_id = t2.customer_id JOIN order_items AS t3 ON t2.order_id = t3.order_id GROUP BY t1.customer_name ORDER BY SUM(CAST(t3.order_quantity AS integer)) DESC LIMIT 1,SELECT c.customer_name FROM Customers c JOIN Customer_Orders co ON c.customer_id = co.customer_id JOIN Order_Items oi ON co.order_id = oi.order_id GROUP BY c.customer_name ORDER BY SUM(oi.order_quantity) DESC LIMIT 1;,[['Clifford Pagac']],[['Error']],FALSE
144,What is the payment method of the customer that has purchased the least quantity of items?,"SELECT t1.payment_method FROM customers AS t1 JOIN customer_orders AS t2 ON t1.customer_id = t2.customer_id JOIN order_items AS t3 ON t2.order_id = t3.order_id GROUP BY t1.customer_name, t1.payment_method ORDER BY SUM(CAST(t3.order_quantity AS integer)) LIMIT 1","SELECT c.payment_method FROM Customers c JOIN Customer_Orders co ON c.customer_id = co.customer_id JOIN Order_Items oi ON co.order_id = oi.order_id GROUP BY c.customer_id, c.payment_method ORDER BY SUM(CAST(oi.order_quantity AS INTEGER)) ASC LIMIT 1;",[['Credit Card']],[['Credit Card']],TRUE
145,Tell me the payment method used by the customer who ordered the least amount of goods in total.,"SELECT t1.payment_method FROM customers AS t1 JOIN customer_orders AS t2 ON t1.customer_id = t2.customer_id JOIN order_items AS t3 ON t2.order_id = t3.order_id GROUP BY t1.customer_name, t1.payment_method ORDER BY SUM(CAST(t3.order_quantity AS integer)) LIMIT 1","SELECT c.payment_method FROM Customers c JOIN Customer_Orders co ON c.customer_id = co.customer_id JOIN Order_Items oi ON co.order_id = oi.order_id GROUP BY c.customer_id, c.payment_method ORDER BY SUM(oi.order_quantity::integer) ASC LIMIT 1;",[['Credit Card']],[['Credit Card']],TRUE
146,What are names of customers who never ordered product Latte.,SELECT customer_name FROM customers EXCEPT SELECT t1.customer_name FROM customers AS t1 JOIN customer_orders AS t2 ON t1.customer_id  =  t2.customer_id JOIN order_items AS t3 ON t2.order_id  =  t3.order_id JOIN products AS t4 ON t3.product_id  =  t4.product_id WHERE t4.product_details  =  'Latte',SELECT customer_name  FROM Customers  WHERE customer_id NOT IN (     SELECT Customer_Orders.customer_id      FROM Customer_Orders      JOIN Order_Items ON Customer_Orders.order_id = Order_Items.order_id      JOIN Products ON Order_Items.product_id = Products.product_id      WHERE product_details = 'Latte' );,"[['Prof. Alexzander Hamill'], ['Tillman Ernser'], ['Prof. Ibrahim Bashirian'], ['Dr. Julia Wuckert MD'], ['Alexane Kilback'], ['Eunice Morar'], ['Prof. Reyes Berge II'], ['Devin Mills'], ['Mozell Morissette'], ['Miss Aliyah Witting'], ['Maudie Kertzmann'], ['Rodrick Heaney'], ['Kitty Padberg III']]","[['Dr. Julia Wuckert MD'], ['Tillman Ernser'], ['Rodrick Heaney'], ['Prof. Alexzander Hamill'], ['Prof. Reyes Berge II'], ['Maudie Kertzmann'], ['Mozell Morissette'], ['Eunice Morar'], ['Devin Mills'], ['Kitty Padberg III'], ['Miss Aliyah Witting'], ['Alexane Kilback'], ['Prof. Ibrahim Bashirian']]",FALSE
147,What are the names of customers who have purchased both products Latte and Americano?,SELECT t1.customer_name FROM customers AS t1 JOIN customer_orders AS t2 ON t1.customer_id  =  t2.customer_id JOIN order_items AS t3 ON t2.order_id  =  t3.order_id JOIN products AS t4 ON t3.product_id  =  t4.product_id WHERE t4.product_details  =  'Latte' INTERSECT SELECT t1.customer_name FROM customers AS t1 JOIN customer_orders AS t2 ON t1.customer_id  =  t2.customer_id JOIN order_items AS t3 ON t2.order_id  =  t3.order_id JOIN products AS t4 ON t3.product_id  =  t4.product_id WHERE t4.product_details  =  'Americano',"SELECT DISTINCT c.customer_name FROM Customers c JOIN Customer_Orders co ON c.customer_id = co.customer_id JOIN Order_Items oi ON co.order_id = oi.order_id JOIN Products p ON oi.product_id = p.product_id WHERE p.product_details IN ('Latte', 'Americano') GROUP BY c.customer_name HAVING COUNT(DISTINCT p.product_details) = 2;",[['Clifford Pagac']],[['Clifford Pagac']],TRUE
148,What are the famous titles of artists who have not only had volumes that spent more than 2 weeks on top but also volumes that spent less than 2 weeks on top?,SELECT T1.Famous_Title FROM artist AS T1 JOIN volume AS T2 ON T1.Artist_ID  =  T2.Artist_ID WHERE T2.Weeks_on_Top  >  2 INTERSECT SELECT T1.Famous_Title FROM artist AS T1 JOIN volume AS T2 ON T1.Artist_ID  =  T2.Artist_ID WHERE T2.Weeks_on_Top  <  2,SELECT DISTINCT artist.Famous_Title FROM artist JOIN volume ON artist.Artist_ID = volume.Artist_ID WHERE volume.Weeks_on_Top > 2 AND artist.Artist_ID IN (     SELECT artist.Artist_ID     FROM artist     JOIN volume ON artist.Artist_ID = volume.Artist_ID     WHERE volume.Weeks_on_Top < 2 );,[['Bergen 1996']],[['Bergen 1996']],TRUE
149,Find the last name of the first ever contact person of the organization with the highest UK Vat number.,SELECT t3.individual_last_name FROM organizations AS t1 JOIN organization_contact_individuals AS t2 ON t1.organization_id  =  t2.organization_id JOIN individuals AS t3 ON t2.individual_id  =  t3.individual_id WHERE t1.uk_vat_number  =  (SELECT max(uk_vat_number) FROM organizations) ORDER BY t2.date_contact_to ASC LIMIT 1,SELECT individual_last_name FROM Individuals WHERE individual_id = (     SELECT individual_id     FROM Organization_Contact_Individuals     WHERE organization_id = (         SELECT organization_id         FROM Organizations         ORDER BY uk_vat_number DESC         LIMIT 1     )     ORDER BY date_contact_from     LIMIT 1 );,[['Jacobs']],[['Rutherford']],FALSE
