,qNL,true_SQL,qSQL,true_SQL_result,qSQL_result,equality
72,Find the number of classes offered for all class rooms that held at least 2 classes.,"SELECT count(*) ,  class_room FROM CLASS GROUP BY class_room HAVING count(*)  >=  2","SELECT CLASS_ROOM, COUNT(*) AS NUM_CLASSES FROM CLASS GROUP BY CLASS_ROOM HAVING COUNT(*) >= 2;","[[4, 'KLR200'], [2, 'BUS252'], [2, 'BUS311'], [3, 'KLR209']]","[['KLR200', 4], ['BUS252', 2], ['BUS311', 2], ['KLR209', 3]]",FALSE
73,How many different professors are there for the different schools?,"SELECT count(*) ,  T1.school_code FROM department AS T1 JOIN professor AS T2 ON T1.dept_code  =  T2.dept_code GROUP BY T1.school_code",SELECT COUNT(DISTINCT P.EMP_NUM)  FROM PROFESSOR P  JOIN DEPARTMENT D ON P.DEPT_CODE = D.DEPT_CODE  GROUP BY D.SCHOOL_CODE;,"[[12, 'A&SCI'], [10, 'BUS']]","[[12], [10]]",FALSE
74,What is the name and the average gpa of department whose students have the highest average gpa?,"SELECT T2.dept_name ,  avg(T1.stu_gpa) 
FROM student AS T1 JOIN department AS T2 ON T1.dept_code  =  T2.dept_code 
GROUP BY T2.dept_name  
ORDER BY avg(T1.stu_gpa) 
DESC LIMIT 1","SELECT DEPARTMENT.DEPT_NAME, AVG(STUDENT.STU_GPA) AS AVG_GPA FROM DEPARTMENT JOIN STUDENT ON DEPARTMENT.DEPT_CODE = STUDENT.DEPT_CODE GROUP BY DEPARTMENT.DEPT_NAME ORDER BY AVG_GPA DESC LIMIT 1;","[['Computer Info. Systems', Decimal('3.1800000000000000')]]","[['Computer Info. Systems', Decimal('3.1800000000000000')]]",TRUE
75,Find the name of the department that offers the largest number of credits of all classes.,"SELECT T3.dept_name 
FROM course AS T1 
JOIN CLASS AS T2 ON T1.crs_code  =  T2.crs_code 
JOIN department AS T3 ON T1.dept_code  =  T3.dept_code 
GROUP BY T3.dept_name  
ORDER BY sum(T1.crs_credit) DESC LIMIT 1",SELECT DEPT_NAME  FROM DEPARTMENT  WHERE DEPT_CODE = (     SELECT DEPT_CODE      FROM COURSE      GROUP BY DEPT_CODE      ORDER BY SUM(CRS_CREDIT) DESC      LIMIT 1 );,[['Computer Info. Systems']],[['Computer Info. Systems']],TRUE
76,How many students are enrolled in the class taught by some professor from the accounting department?,SELECT count(*) FROM CLASS AS T1 JOIN enroll AS T2 ON T1.class_code  =  T2.class_code JOIN course AS T3 ON T1.crs_code  =  T3.crs_code JOIN department AS T4 ON T3.dept_code  =  T4.dept_code WHERE T4.dept_name  =  'Accounting',SELECT COUNT(DISTINCT STU_NUM)  FROM ENROLL  WHERE CLASS_CODE IN (     SELECT CLASS_CODE      FROM CLASS      WHERE PROF_NUM IN (         SELECT EMP_NUM          FROM PROFESSOR          WHERE DEPT_CODE IN (             SELECT DEPT_CODE              FROM DEPARTMENT              WHERE DEPT_NAME = 'Accounting'         )     ) );,[[2]],[[2]],TRUE
77,What is the name of the department that has the largest number of students enrolled?,"SELECT T4.dept_name 
FROM CLASS AS T1 
JOIN enroll AS T2 ON T1.class_code  =  T2.class_code 
JOIN course AS T3 ON T1.crs_code  =  T3.crs_code 
JOIN department AS T4 ON T3.dept_code  =  T4.dept_code 
GROUP BY T4.dept_name 
ORDER BY count(*) DESC LIMIT 1",SELECT DEPT_NAME  FROM DEPARTMENT  WHERE DEPT_CODE IN (     SELECT DEPT_CODE      FROM STUDENT      GROUP BY DEPT_CODE      ORDER BY COUNT(STU_NUM) DESC      LIMIT 1 );,[['Computer Info. Systems']],[['Accounting']],FALSE
78,Find the first name of student who is taking classes from accounting and Computer Info. Systems departments,SELECT T1.stu_fname FROM student AS T1 JOIN enroll AS T2 ON T1.stu_num  =  T2.stu_num JOIN CLASS AS T3 ON T2.class_code  =  T3.class_code JOIN course AS T4 ON T3.crs_code  =  T4.crs_code JOIN department AS T5 ON T5.dept_code  =  T4.dept_code WHERE T5.dept_name  =  'Accounting' INTERSECT SELECT T1.stu_fname FROM student AS T1 JOIN enroll AS T2 ON T1.stu_num  =  T2.stu_num JOIN CLASS AS T3 ON T2.class_code  =  T3.class_code JOIN course AS T4 ON T3.crs_code  =  T4.crs_code JOIN department AS T5 ON T5.dept_code  =  T4.dept_code WHERE T5.dept_name  =  'Computer Info. Systems',"SELECT STU_FNAME  FROM STUDENT  WHERE STU_NUM IN (     SELECT STU_NUM      FROM ENROLL      WHERE CLASS_CODE IN (         SELECT CLASS_CODE          FROM CLASS          WHERE CRS_CODE IN (             SELECT CRS_CODE              FROM COURSE              WHERE DEPT_CODE IN (                 SELECT DEPT_CODE                  FROM DEPARTMENT                  WHERE DEPT_NAME IN ('Accounting', 'Computer Info. Systems')             )         )     ) );","[['Anne'], ['William']]","[['Anne'], ['William']]",TRUE
79,Find the first names and offices of all instructors who have taught some course and the course description and the department name.,"SELECT T2.emp_fname ,  T4.prof_office ,  T3.crs_description ,  T5.dept_name FROM CLASS AS T1 JOIN employee AS T2 ON T1.prof_num  =  T2.emp_num JOIN course AS T3 ON T1.crs_code  =  T3.crs_code JOIN professor AS T4 ON T2.emp_num  =  T4.emp_num JOIN department AS T5 ON T4.dept_code  =  T5.dept_code","SELECT EMPLOYEE.EMP_FNAME, PROFESSOR.PROF_OFFICE, COURSE.CRS_DESCRIPTION, DEPARTMENT.DEPT_NAME FROM PROFESSOR JOIN EMPLOYEE ON PROFESSOR.EMP_NUM = EMPLOYEE.EMP_NUM JOIN CLASS ON PROFESSOR.EMP_NUM = CLASS.PROF_NUM JOIN COURSE ON CLASS.CRS_CODE = COURSE.CRS_CODE JOIN DEPARTMENT ON PROFESSOR.DEPT_CODE = DEPARTMENT.DEPT_CODE;","[['Arnelle', 'KLR 229D', 'Accounting I', 'Accounting'], ['Arnelle', 'KLR 229D', 'Accounting I', 'Accounting'], ['Robert', 'BBG 208', 'Accounting I', 'Sociology'], ['Ismael', 'KLR 244', 'Accounting II', 'Accounting'], ['Ismael', 'KLR 244', 'Accounting II', 'Accounting'], ['Carlos', 'KLR 300', 'Intro. to Microcomputing', 'Computer Info. Systems'], ['Gerald', 'KLR 211', 'Intro. to Microcomputing', 'Accounting'], ['Carlos', 'KLR 300', 'Intro. to Microcomputing', 'Computer Info. Systems'], ['Peter', 'KLR 203E', 'Database Design and Implementation', 'Computer Info. Systems'], ['Gerald', 'KLR 211', 'Intro. to Statistics', 'Accounting'], ['Gerald', 'KLR 211', 'Intro. to Statistics', 'Accounting'], ['Peter', 'KLR 203E', 'Statistical Applications', 'Computer Info. Systems'], ['Peter', 'KLR 203E', 'Statistical Applications', 'Computer Info. Systems']]","[['Arnelle', 'KLR 229D', 'Accounting I', 'Accounting'], ['Arnelle', 'KLR 229D', 'Accounting I', 'Accounting'], ['Robert', 'BBG 208', 'Accounting I', 'Sociology'], ['Ismael', 'KLR 244', 'Accounting II', 'Accounting'], ['Ismael', 'KLR 244', 'Accounting II', 'Accounting'], ['Carlos', 'KLR 300', 'Intro. to Microcomputing', 'Computer Info. Systems'], ['Gerald', 'KLR 211', 'Intro. to Microcomputing', 'Accounting'], ['Carlos', 'KLR 300', 'Intro. to Microcomputing', 'Computer Info. Systems'], ['Peter', 'KLR 203E', 'Database Design and Implementation', 'Computer Info. Systems'], ['Gerald', 'KLR 211', 'Intro. to Statistics', 'Accounting'], ['Gerald', 'KLR 211', 'Intro. to Statistics', 'Accounting'], ['Peter', 'KLR 203E', 'Statistical Applications', 'Computer Info. Systems'], ['Peter', 'KLR 203E', 'Statistical Applications', 'Computer Info. Systems']]",TRUE
80,What are the first names of all Accounting professors who teach and what are the classrooms of the courses they teach?,"SELECT T2.emp_fname ,  T1.class_room FROM CLASS AS T1 JOIN employee AS T2 ON T1.prof_num  =  T2.emp_num JOIN professor AS T3 ON T2.emp_num  =  T3.emp_num JOIN department AS T4 ON T4.dept_code  =  T3.dept_code WHERE T4.dept_name  =  'Accounting'","SELECT EMPLOYEE.EMP_FNAME, CLASS.CLASS_ROOM FROM PROFESSOR JOIN EMPLOYEE ON PROFESSOR.EMP_NUM = EMPLOYEE.EMP_NUM JOIN DEPARTMENT ON PROFESSOR.DEPT_CODE = DEPARTMENT.DEPT_CODE JOIN CLASS ON PROFESSOR.EMP_NUM = CLASS.PROF_NUM WHERE DEPARTMENT.DEPT_NAME = 'Accounting';","[['Arnelle', 'BUS311'], ['Arnelle', 'BUS200'], ['Ismael', 'BUS311'], ['Ismael', 'BUS252'], ['Gerald', 'KLR211'], ['Gerald', 'KLR200'], ['Gerald', 'KLR200']]","[['Arnelle', 'BUS311'], ['Arnelle', 'BUS200'], ['Ismael', 'BUS311'], ['Ismael', 'BUS252'], ['Gerald', 'KLR211'], ['Gerald', 'KLR200'], ['Gerald', 'KLR200']]",TRUE
81,Find the id and number of shops for the company that produces the most expensive furniture.,"SELECT t1.manufacturer_id ,  t1.num_of_shops FROM manufacturer AS t1 JOIN furniture_manufacte AS t2 ON t1.manufacturer_id  =  t2.manufacturer_id ORDER BY t2.Price_in_Dollar DESC LIMIT 1","SELECT m.Manufacturer_ID, m.Num_of_Shops FROM manufacturer m JOIN furniture_manufacte fm ON m.Manufacturer_ID = fm.Manufacturer_ID WHERE fm.Price_in_Dollar = (     SELECT MAX(Price_in_Dollar)     FROM furniture_manufacte );","[[7, 4]]","[[7, 4]]",TRUE
82,Find the name of the company that produces both furnitures with less than 6 components and furnitures with more than 10 components.,SELECT t3.name FROM furniture AS t1 JOIN furniture_manufacte AS t2 ON t1.Furniture_ID  =  t2.Furniture_ID JOIN manufacturer AS t3 ON t2.manufacturer_id  =  t3.manufacturer_id WHERE t1.num_of_component  <  6 INTERSECT SELECT t3.name FROM furniture AS t1 JOIN furniture_manufacte AS t2 ON t1.Furniture_ID  =  t2.Furniture_ID JOIN manufacturer AS t3 ON t2.manufacturer_id  =  t3.manufacturer_id WHERE t1.num_of_component  >  10,SELECT DISTINCT m.Name FROM manufacturer m WHERE EXISTS (     SELECT 1     FROM furniture_manufacte fm     JOIN furniture f ON fm.Furniture_ID = f.Furniture_ID     WHERE fm.Manufacturer_ID = m.Manufacturer_ID AND f.Num_of_Component < 6 ) AND EXISTS (     SELECT 1     FROM furniture_manufacte fm     JOIN furniture f ON fm.Furniture_ID = f.Furniture_ID     WHERE fm.Manufacturer_ID = m.Manufacturer_ID AND f.Num_of_Component > 10 );,[['Tomorrow']],[['Tomorrow']],TRUE
